company_name,services_provided,mbe_wbe_cert,small_local_cert,veteran_cert,sdo_cert,has_bais_id,address,city,state,zipcode,contact_name,contact_title,phone,fax,email,business_type,construction,year_established,number_employees,business_area_1,business_area_2,business_area_3,naics_1,naics_2,naics_3
"C.R.C. Company, Inc.",General and marine construction   ,WBE,SBE,,true,true,77 Federal Avenue Quincy MA 02169,Quincy,MA,02169,Ms. Carolyn Cashman,President,(617) 328-0800,(617) 773-2499,,Profit,true,1979,21-40,CM - Concrete & Masonry Contractors,GC - General Contractors,EP - Equiment Rental (Heavy Construction),237990 - Other Heavy and Civil Engineering Construction ,,
Crescent Graphics,"Print letterhead, envelops, forms brochures, three part forms; computer forms, business cards, invitations   Etc.",MBE,,,false,true,169 Norfolk Avenue Roxbury MA 02119,Roxbury,MA,02119,Mr. Steadman J Bramble,Owner,(617) 442-8282,(617) 442-4466,,Profit,false,1995,Under 10,PT - Printers,,,,,
"Crittenton, Inc.",Social and human services; housing and food services   ,WBE,,,false,true,10 Perthshire Road Brighton MA 02135,Brighton,MA,02135,Ms. Elizabeth Babcock,"Dir., Planning & Instit. Dev't",(617) 782-7600,(617)254-7966,rgair@liveworkthrive.org,Not-for-Profit,false,,,HO - Housing Advocacy,MO - Multi Service Organizations,,,,
"Crosswinds Enterprises, Inc.","Construction of buildings and other structures; renovating buildings, structures; and painting building structures   ",MBE,SLBE,,false,true,97 Humboldt Ave Dorchester MA 02121,Dorchester,MA,02121,Mr. Arnold C Johnson,President,(617) 445-5100,(617) 445-5482,xxwinds@aol.com,Profit,true,1988,10-20,GC - General Contractors,PA - Painting and Papering Contractors,,,,
"Crystal Transportation, Inc.","Provide transportation to groups, organizations and associations to all parts of the United States   ",WBE,SLBE,,false,true,1605 Hyde Park Avenue Hyde Park MA 02136,Hyde Park,MA,02136,Ms. Linda Carroll,,(617) 787-1544,(617) 787-8133,,Profit,false,1983,Over 100,"TR - Travel, Transportation (Travel Agencies, Planning, Limo Services)",,,,,
"CUB Systems, Inc.","Manufacturers and distributors of floor boxes with power, communication, air, water, drains   ",WBE,SBE,,true,false,5325 N. Commerce Moorpark CA 93021,Moorpark,CA,93021,Ms. Kathleen M Lowe,President/Owner,(805) 529-0119,(805) 529-9466,kate@floorboxes.com,Profit,true,1998,Under 10,"EO - Electronic Parts (Mgfs., Distrib., Assembly Service)","FB - Fabricators (Metals, Plastics)",MU - Manufacturers,339999 - All Other Miscellaneous Manufacturing ,,
"Custom Floors Design, Inc.",Sales and installation of all floor covering products.   ,MWBE,SBE,,true,false,271 Main Street Stoneham MA 02180,Stoneham,MA,02180,Ms. Jennifer Roberts,President,(781) 933-4124,(781) 854-0202,jen@customfloorsdesign.com,Profit,true,2007,Under 10,"FL - Floor Contractors (Carpet, Tile, Linoleum)",,,238330 - Flooring Contractors,,
"Custom Networks, Inc.",Power and cooling:  uninterruptible power supply (UPS) and data center air conditioning   upgrade and maintenance,MBE,SBE,,true,true,66 Tadmuck Road Westford MA 01886-3155,Westford,MA,01886-3155,Mr. Moiz A Bhindarwala,President,(978) 392-0060,,moiz@customnetworks.net,Profit,false,1990,Under 10,"CP - Computer (Hardware, Software, Design, Data Processing (see also COS, COT)","OF - Office Furniture, Services and Equipment",SU - Suppliers,541519 - Other Computer Related Services,,
"C. White Marine, Inc.","Marine construction, pile driving, and erection of pre-engineered metal buildings   ",WBE,,,false,true,160 Sylvan Street Danvers MA 01923,Danvers,MA,01923,Ms. Catherine M White,President,(978) 777-5656,(978) 750-6721,cwhite@cwhitemarine.com,Profit,true,1994,10-20,UI - Underwater Inspection Contractors,GC - General Contractors,,,,
Dagle Electrical Construction Corporation,Electrical contractor; traffic signal; street lighting; installation and maintenance   ,WBE,,,true,true,P.O. Box 760982 Melrose MA 02176,Melrose,MA,02176,Ms. Maureen P Dagle,President,(800) 379-1459,(781) 937-7678,maureen@deccorp.com,Profit,true,,41-100,EL - Electrical Contractors,,,238210 - Electrical Contractors and Other Wiring Installation Contractors,,
"Daily General Counsel, PLLC",Legal services; business consulting   ,WBE,,,false,true,12 Stedman Street Brookline MA 02446,Brookline,MA,02446,Ms. Jan Glassman,Managing Member,(800) 296-7681,,jan.glassman@dailygc.com,Profit,false,2012,Under 10,AT - Attorneys,,,541110 - Offices of Lawyers,541199 - All Other Legal Services ,
"David Fox, Photographer dba Foremost","Photography, video and consulting   ",,SBE,,false,false,"C/O Films and Videos, Inc. Framingham MA 01702",Framingham,MA,01702,Mr. David Fox,Owner,(508) 820-1130,(508) 820-0558,,Profit,false,1982,Under 10,PG - Photography,,,"541921 - Photography Studios, Portrait ",541922 - Commercial Photography ,
"Day Health Strategies, LLC",Consulting services on design and implementation of healthcare reform programs   ,WBE,SBE,,true,false,324 Broadway Somerville MA 02145,Somerville,MA,02145,Ms. Rosemarie Day,President,(617) 666-0040,,rosemarie@dayhealthstrategies.com,Profit,false,2012,,"COH - Consultants: Health, Psychological",,,"541990 - All Other Professional, Scientific, and Technical Services",,
D. Bellavance Agency,Computer and writing training   ,WBE,SLBE,,true,false,291 Beacon Street Boston MA 02116,Boston,MA,02116,Ms. Diane M Bellavance,Owner,(617) 262-0411,,dbellava@alumni.neu.edu,Profit,false,1977,Under 10,COM - Consultants: Management,PU - Publishers,,611420 - Computer Training ,611430 - Professional and Management Development Training ,
"DCR, Inc.",Masonry contractor   ,WBE,SBE,,false,false,6 B Street Burlington MA 01803,Burlington,MA,01803,Ms. Carla Salvucci,President,(781) 229-6543,(781) 272-1585,csalvucci@dcrmasonry.com,Profit,true,1999,10-20,CM - Concrete & Masonry Contractors,,,238140 - Masonry Contractors ,,
D & D Towing,Towing company   ,WBE,SLBE,,false,true,1 Ellery Street South Boston MA 02127,South Boston,MA,02127,Ms. Elizabeth Wheeler,Owner,(617) 464-8697,(617) 464-0484,dwhe605849@aol.com,Profit,false,1993,Under 10,TK - Trucking (Waste Disposal Commodities Transport),,,488410 - Motor Vehicle Towing,488999 - All Other Support Activities for Transportation ,
"Decades of Dance Entertainment, Inc. dba","Dj's,  Musicians and Misc. Performers   ",,SBE,,false,false,Craig Sutton Entertainment Svc Framingham MA 01701,Framingham,MA,01701,Mr. Craig Sutton,,(508) 877-8535,(508) 877-8435,,Profit,false,1992,Under 10,ET - Entertainment/Entertainer,,,"711410 - Agents and Managers for Artists, Athletes, Entertainers, and Other Public Figures","711510 - Independent Artists, Writers, and Performers ",
Delectable Desires Pastries,"Bakery, providing all types of baked goods, beverages, and special order cakes; and catering services   ",MWBE,SLBE,,false,true,1755 Centre Street West Roxbury MA 02132,West Roxbury,MA,02132,Ms. Carlene O'Garro,Owner,(617) 678-6001,,carlene@delectabledesires.net,Profit,false,2014,Under 10,CT - Catering,"FD - Food Products, Services",,445291 - Baked Goods Stores ,722320 - Caterers,
"Delta X Industries, Inc.","Supplier of math teaching aids:  games, manipulatives, drawing instruments, videos, workbooks and computer software manipulatives, drawing instruments, videos, workbooks and computer software   ",WBE,,,false,false,P.O. Box 256 Marinette WI 54143,Marinette,WI,54143,Jean M Hornick,President,(715) 789-2954,(715) 789-2957,,Profit,false,1977,Under 10,"CP - Computer (Hardware, Software, Design, Data Processing (see also COS, COT)","ED - Education (see also OS, TA)",,,,
"Dependable Masonry Construction Company, Inc.",Masonry; brick paving; curbsetting; manholes and sidewalks   ,MBE,SBE,,true,false,1245 Hancock Street Quincy MA 02169,Quincy,MA,02169,Mr. Edmund A Henry,President,(978) 664-5453,(978) 664-1360,dmcci@hotmail.com,Profit,true,1978,21-40,CM - Concrete & Masonry Contractors,"PL - Plastering, Drywall Contractors",CA - Carpentry,238140 - Masonry Contractors ,,
"DePrizio Paving and Construction Company, Inc.",All types of interior and exterior demolition work   ,,SBE,SDVOSB,false,false,793 Turnike Street North Andover MA 01845,North Andover,MA,01845,Mr. Louis J DePrizio,President,(617) 884-1802,(617) 884-2506,ldeprizio@verizon.net,Profit,true,1977,Under 10,"SI - Sitework (Excavation, Demolition, Utilities, Sewage, see also GC)",,,238910 - Site Preparation Contractors,,
Design Construction Consulting Services,Construction; consulting; restoration; renovation   ,MBE,SLBE,,false,true,74 Howland Street Dorchester MA 02121,Dorchester,MA,02121,Mr. Cesar DaSilva,President,(617) 541-0900,(617) 541-9990,dccs@comcast.net,Profit,true,2001,Under 10,GC - General Contractors,,,236115 - New Single-Family Housing Construction (except For-Sale Builders) ,236118 - Residential Remodelers ,236220 - Commercial and Institutional Building Construction 
Designer Masonry Inc.,"Specializing in masonry, brick, stone;  commercial and residential   ",MBE,SLBE,,true,true,P.O. Box 24089 Dorchester MA 02124,Dorchester,MA,02124,Mr. Thurgood Jones,President,(617) 474-9882,(617) 474-9884,designermasonry@hotmail.com,Profit,true,2001,Under 10,CM - Concrete & Masonry Contractors,"ER - Exterior Restoration, Sandblasting (Anti-Graffiti)",PV - Paving Contractors,238140 - Masonry Contractors ,,
"designLAB architects, Inc.",Architectural and design services   ,,SLBE,,false,true,35 Channel Center Street Boston MA 02210,Boston,MA,02210,Mr. Robert Miklos,President,(617) 350-3005,(617) 350-6006,rmiklos@designlabarch.com,Profit,false,2005,10-20,AE - Architects/Engineers,,,541310 - Architectural Services,,
Devon Plumbing & Heating Corp.,All types of plumbing and heating   ,MBE,SLBE,,true,true,52 Evelyn Street Mattapan MA 02126,Mattapan,MA,02126,Mr. Devon R Graham,,(617) 298-2728,(617) 296-5134,devonplumbing@yahoo.com,Profit,true,1987,Under 10,PB - Plumbing,,,"238220 - Plumbing, Heating, and Air-Conditioning Contractors ",,
"DHK Architects, Inc.","Architectural planning and design for public and private clients in areas of housing, transportation, industrial and institutional facilities   facilities and institutional facilities",MBE,SLBE,,true,true,54 Canal Street Boston MA 02114,Boston,MA,02114,"Mr. Fernando M Domenech, Jr.",President,(617) 267-6408,(617) 267-1990,,Profit,false,1978,21-40,AE - Architects/Engineers,"COA - Consultants: Architecture, Engineering",COD - Consultants: Design,541310 - Architectural Services,,
"Different Tastes, Inc.",Catering and special event coordination   ,,SBE,,false,true,103A Broadway Chelsea MA 02150,Chelsea,MA,02150,John Milan,Mr.,(617) 884-3791,(617) 884-9366,,Profit,false,1981,21-40,CT - Catering,"FD - Food Products, Services",,722320 - Caterers,,
"Diversified Technology Consultants, Inc.","Structural engineering, civil engineering, mechanical engineering, electrical engineering, landscape architecture, transportation and bridge design, plumbing and fire protection design   ",MBE,,,true,false,305 N. Main Street Andover MA 01810,Andover,MA,01810,Mr. Sailesh Alturu,President and CEO,(978) 475-2935,(203) 234-7376,robert.hammersley@teamdtc.com,Profit,false,1979,41-100,"COA - Consultants: Architecture, Engineering",CON - Consultants: Environmental,COU - Consultants: Transportation,541330 - Engineering Services,541620 - Environmental Consulting Services,"541990 - All Other Professional, Scientific, and Technical Services"
"Divino Nino Childcare and Home Provider Program, Inc.",Consulting services specializing in home daycare providers,MWBE,,,true,false,"20 Central Avenue, Suite 501 Lynn MA 01902",Lynn,MA,01902,Ms. Milka Ramos,President,(781) 632-7603,,divinoninochildcare@gmail.com,Profit,false,2019,Under 10,CC - Childcare,,,624410 - Child Day Care Services ,,
"DKI Engineering and Consulting USA, P.C.","Feasibility studies, design, engineering, planning and construction management for airports, bridges, highways, railroad, transits, high speed transit, light rail transit, tunnels, and water/wastewater facilities   ",MBE,SBE,,true,false,1 Deep Woods Drive  Latham NY 12110,Latham,NY,12110,Mr. Dhirendra K Gupta,President,(518) 373-4999,(518) 373-6657,dki123@aol.com,Profit,false,1978,Under 10,AE - Architects/Engineers,"COA - Consultants: Architecture, Engineering",COD - Consultants: Design,541330 - Engineering Services,,
"D.L. Wareham, Inc. dba First Call Trucking","Delivery service, trucks and vans; and warehousing   ",WBE,SLBE,,false,false,33 Tozer Road Beverly MA 01915,Beverly,MA,01915,Mr. John J DeFazio,,(617) 330-5100,(617) 330-9309,nancy@firstcalltrucking.com,Profit,true,1992,Under 10,TK - Trucking (Waste Disposal Commodities Transport),,,,492210 - Local Messengers and Local Delivery,
Documenting Life's Moments Photography,"Photography, portrait and commercial   ",,SLBE,,false,false,26 South Walter Street Roslindale MA 02131,Roslindale,MA,02131,Mr. David Lang,Owner,(508) 740-2992,,dave@documentinglifesmoments.com,Profit,false,2010,Under 10,PG - Photography,,,"541921 - Photography Studios, Portrait ",541922 - Commercial Photography ,
"Done Right Building Services, Inc.",Janitorial and maintenance services; mechanical maintenance; landscaping and snow removal; and consulting   ,MBE,SLBE,,true,true,Four Copley Place Boston MA 02116,Boston,MA,02116,Mr. Anthony A Samuels,President,(617) 236-0155,(617) 236-0704,asamuels@donerightservices.com,Profit,false,1993,21-40,"JA - Janitorial Services/Supplies (see also MA, RS)",PA - Painting and Papering Contractors,LA - Landscaping Contractors,561720 - Janitorial Services ,,
Don Martin Corporation,"Paving, road construction; equipment rental   ",MBE,,,true,false,475 School Street Marshfield MA 02050,Marshfield,MA,02050,"Mr. Donald J Martin, Jr.",,(781) 834-0071,(781) 834-6538,donmartin@donmartincorp.com,Profit,true,1983,21-40,PV - Paving Contractors,"SI - Sitework (Excavation, Demolition, Utilities, Sewage, see also GC)",,238910 - Site Preparation Contractors,"237310 - Highway, Street, and Bridge Construction ",
Dorchester Bay Economic Development Corporation,Developers and owners of rental housing units; small business loans   ,MBE,,,false,true,594 Columbia Road Dorchester MA 02125,Dorchester,MA,02125,Mr. Perry Newman,CEO,(617) 533-9586,(617) 825-3522,pnewman@dbedc.org,Not-for-Profit,false,1979,21-40,EC - Economic Development,,,531110 - Lessors of Residential Buildings and Dwellings ,522291 - Consumer Lending ,925120 - Administration of Urban Planning and Community and Rural Development 
"DREAM Collaborative, LLC","Architecture, urban design, and sustainability/LEED",MBE,,,true,false,"31 St. James Avenue, 6th Floor Boston MA 02116",Boston,MA,02116,Mr. Gregory Minott,Managing Principal,(617) 606-7029,,gmateo@dreamcollaborative.com,Profit,false,2008,21-40,AE - Architects/Engineers,,,541310 - Architectural Services,,
"Drywall Plus, Inc.","Light commercial construction, including framing, drywall installation and painting ",MBE,SLBE,,false,false,239 Fuller Street Dorchester MA 02124,Dorchester,MA,02124,Mr. Frank Harris,President.,(617) 445-4287,(617) 265-4131,,Profit,true,1989,Under 10,"PL - Plastering, Drywall Contractors",PA - Painting and Papering Contractors,CA - Carpentry,,,
D. Silva Trucking,"Trucking, hauling   ",MBE,,,true,false,270 Centre Street Carver MA 02330,Carver,MA,02330,Mr. Daniel Silva,Owner,(508) 866-2478,,,Profit,true,1988,Under 10,TK - Trucking (Waste Disposal Commodities Transport),,,,,
"Eagle Development Partners, LLC","Real estate development, construction management, owners project manager   ",MBE,SBE,,true,false,105 Central Street Stoneham MA 02180,Stoneham,MA,02180,Mr. Gosder Cherilus,President,(781) 279-0060,,gcherilus@eagledevelopmentpartners.com,Profit,true,2010,Under 10,"RE - Real Estate (Development, Management, Sales and Appraisals)",CN - Construction Management: Small Commercial Projects,COB - Consultants: City Planning,236116 - New Multifamily Housing Construction (except For-Sale Builders) ,,
"Eagle Point Builders, Inc.","General contractor, including general building construction; carpentry; tile work; masonry; roofing   shingles); and snow plowing",WBE,SBE,,true,false,54 Burnham Street Belmont MA 02478,Belmont,MA,02478,Ms. Theresa L Moroso,President,(617) 484-3664,(617) 209-2130,epbbuilders@aol.com,Profit,true,1991,10-20,GC - General Contractors,CA - Carpentry,CM - Concrete & Masonry Contractors,238350 - Finish Carpentry Contractors,238140 - Masonry Contractors ,238160 - Roofing Contractors 
East Coast Petroleum Corporation,Distributor of #2 diesel and heating oil HVAC sales and installation; 24 hour emergency burner service; petroleum sales/without bulk terminals; environmental-remediation; solar sales-regeneration; energy management-audits; natural gas distribution   Conditioning; Enviornmental,WBE,,,true,true,1185 Turnpike Street Stoughton MA 02072,Stoughton,MA,02072,Ms. Loretta T DeGrazia,President,(781) 297-7030,(781) 297-7011,ltd@eastcoastpetroleum.com,Profit,false,1985,10-20,PP - Petroleum Products (Sales/Service),,,221210 - Natural Gas Distribution ,424720 - Petroleum and Petroleum Products Merchant Wholesalers (except Bulk Stations and Terminals) ,221114 - Solar Electric Power Generation 
"Eastern Bag and Paper Company, Inc. dba EBP Supply Solutions",Wholesale distribution of paper goods and janitorial goods   ,WBE,,,true,true,200 Research Drive Milford CT 06460,Milford,CT,06460,Ms. Meredith Reuben,CEO,(203) 878-1814,(203) 783-9824,mreuben@ebpsupply.com,Profit,false,1918,Over 100,SU - Suppliers,"JA - Janitorial Services/Supplies (see also MA, RS)","AHS - Health Care (Providers, Services)",424130 - Industrial and Personal Service Paper Merchant Wholesalers ,424990 - Other Miscellaneous Nondurable Goods Merchant Wholesalers ,
"Eastern General Contractors, Inc.",General contracting; construction management; design build   ,MBE,SBE,,true,false,52-60 Berkshire Avenue Springfield MA 01109,Springfield,MA,01109,Mr. John H Murphy,President,(413) 733-6544,(413) 731-5914,jmurphy@egci.com,Profit,true,1970,41-100,GC - General Contractors,CM - Concrete & Masonry Contractors,CA - Carpentry,236210 - Industrial Building Construction ,,
eBree Design,Custom website design and development; web marketing; search engine optimization (SEO); ExpressionEngine (EE) Content Management Systems (CMS).   ,WBE,SBE,,false,false,24 Rosemary Avenue Wakefield MA 01880,Wakefield,MA,01880,Ms. Bree Rodrigues,Owner,(617) 863-0802,,info@ebree.com,Profit,false,2001,Under 10,AD - Advertising/Audovisual Graphic Design/Marketing Public Relations,"CP - Computer (Hardware, Software, Design, Data Processing (see also COS, COT)",COD - Consultants: Design,541511 - Custom Computer Programming Services ,541512 - Computer Systems Design Services ,541519 - Other Computer Related Services
EcoDocx LLC,Business support services:  OpenText and StreamServe consulting   ,MWBE,SLBE,,false,false,50 Milk Street Boston MA 02109,Boston,MA,02109,Ms. Tien-Tien Lai,Owner,(617) 383-9185,,tlai@ecodocx.com,Profit,false,2009,Under 10,COS - Consultants: Systems Analysis,"OS - Office Services (Clerical Support, Employment, Court Reporting, Typing, etc., see also EM)",,561499 - All Other Business Support Services ,,
"Eco Waste Disposal and Container Storage, Inc.",Waste disposal; recycling; container storage; portable toilet service   ,MBE,SLBE,,true,false,946 Washington Street Dorchester MA 02124,Dorchester,MA,02124,Mr. Jesse Jeter,President,(617) 929-5900,(617) 507-7680,jjeter@ecowdcs.com,Profit,true,2010,Under 10,TK - Trucking (Waste Disposal Commodities Transport),,,562119 - Other Waste Collection ,562111 - Solid Waste Collection ,562991 - Septic Tank and Related Services 
"ECS Video Systems, Inc.","Video equipment rental and services; teleprompters, camera support   ",,SBE,,false,false,50 Hunt Street Watertown MA 02472,Watertown,MA,02472,Mr. Eric Silverstein,President,(617) 924-7300,(617) 926-7965,,Profit,false,1999,Under 10,ET - Entertainment/Entertainer,AD - Advertising/Audovisual Graphic Design/Marketing Public Relations,,532210 - Consumer Electronics and Appliances Rental,,
Educational Consultation Services,"Provide tutorial services in math, chemistry, biology, elementary - 2nd year college; course management, setting up tutorial services   organization, entrepreneur development",MBE,SLBE,,true,false,P.O. Box 190717 Roxbury MA 02119,Roxbury,MA,02119,Mr. Vusama Kariba,President,(617) 427-1428,,vusa77@verizon.net,Profit,false,1990,Under 10,"ED - Education (see also OS, TA)","COH - Consultants: Health, Psychological",EC - Economic Development,611691 - Exam Preparation and Tutoring ,611710 - Educational Support Services,
Eduporium,"STEM education technology, including robots, electronics and circuit kits, 3D printers, virtual reality, computers, and much more",MBE,,,true,true,"1 Bridge Street, Suite 300 Newton MA 02458",Newton,MA,02458,Mr. Richard Fredkin,President and CEO,(617) 600-7230,(617) 977-0980,sales@eduporium.com,Profit,false,2012,10-20,"ED - Education (see also OS, TA)","CP - Computer (Hardware, Software, Design, Data Processing (see also COS, COT)",,611420 - Computer Training ,611519 - Other Technical and Trade Schools ,611710 - Educational Support Services
"Edwards Group LLC, The",Trucking; hauling (materials and debris); snow removal; real estate sales   ,MBE,SLBE,,true,false,57 River Street Boston MA 02126,Boston,MA,02126,Mr. Mark Edwards,,(617) 593-9875,(617) 296-6770,theedwardsgroup.cynthia@comcast.net,Profit,false,2006,Under 10,TK - Trucking (Waste Disposal Commodities Transport),SN - Snow Removal/Plowing (see also TK),"RE - Real Estate (Development, Management, Sales and Appraisals)","484110 - General Freight Trucking, Local ",561730 - Landscaping Services,531210 - Offices of Real Estate Agents and Brokers
"Eglomise Designs, Inc.",Manufacturer of corporate and university related giftware and awards   ,WBE,SBE,,false,false,4 Antietam Street Devens MA 01434,Devens,MA,01434,Ms. Martha Demerjian,,(800) 443-8987,(978) 862-0009,,Profit,false,,21-40,MU - Manufacturers,,,321999 - All Other Miscellaneous Wood Product Manufacturing ,327215 - Glass Product Manufacturing Made of Purchased Glass ,
"Electro Wire, Inc.",Stocking distributor of electrical and electronic wire and cable; manufacturer of electrical cable assemblies; logistical inventory management company   ,MBE,,,true,false,100 Jytek Drive Leominster MA 01453,Leominster,MA,01453,Mr. Mickey M Hamano,President,(978) 534-5300,(978) 534-4825,mhamano@electrowire.com,Profit,true,1978,41-100,"EO - Electronic Parts (Mgfs., Distrib., Assembly Service)",,,,,
Elena Saporta Landscape Architect,Landscape architecture; environmental planning; urban design;   ,WBE,,,true,true,102 Ellery Street Cambridge MA 02138,Cambridge,MA,02138,Ms. Elena Saporta,President,(617) 717-9228,,esla@earthlink.net,Profit,false,1993,Under 10,"LD - Landscaping (Design, Architects)",CON - Consultants: Environmental,AE - Architects/Engineers,,,
Elevator Controls Corporation,Manufacture and assemble elevator controllers   ,MBE,SBE,,false,false,6150 Warehouse Way Sacramento CA 95826,Sacramento,CA,95826,Mr. Fernando Ortiz,President,(916) 4281708,(916) 428-1728,fernando.ortiz@elevatorcontrols.com,Profit,true,1986,41-100,EV - Elevator Contractors,MU - Manufacturers,,333921 - Elevator and Moving Stairway Manufacturing ,,
"Elite Pest Solutions, Inc.","General pest control, exterminating   ",WBE,,,true,true,68 Catherine Drive Peabody MA 01960,Peabody,MA,01960,Ms. Vanessa Giovanniello,President,(617) 595-7634,,vanessa@elitepestma.com,Profit,false,2018,10-20,PE - Pest Control,,,561710 - Exterminating and Pest Control Services,,
"Ellis Painting, Inc.","Painting, commercial and residential; wallpapering; spraypainting   ",MBE,SBE,,true,false,175 Connie Lane Stoughton MA 02072,Stoughton,MA,02072,Mr. Israel Ellis,President,(781) 297-9411,(781) 297-7377,ellispainting@comcast.net,Profit,true,1991,Under 10,PA - Painting and Papering Contractors,"PL - Plastering, Drywall Contractors","PC - Protective Coverings (Water and Fireproofing, Special Coverings/Coatings)",238320 - Painting and Wall Covering Contractors,,
Elm Appraisal Service,Real estate appraisals   ,WBE,SLBE,,false,false,1313 Washington Street Boston MA 02118,Boston,MA,02118,Ms. Joan G Attianese,Owner,(617) 426-3700,(617) 451-5177,joan@elmappraisal.com,Profit,false,1994,Under 10,"RE - Real Estate (Development, Management, Sales and Appraisals)",,,531320 - Offices of Real Estate Appraisers ,,
"EMZ Rainbow Laundromat, LLC",Laundry services; laundromat   ,MBE,SLBE,,false,true,9 Bowdoin Street Dorchester MA 02124,Dorchester,MA,02124,Mr. Caltor McLean,Manager,(617) 825-3200,,rainbowlaundromat09@gmail.com,Profit,false,1996,Under 10,"CL - Commercial Dry Cleaning, Laundry",,,812310 - Coin-Operated Laundries and Drycleaners ,812332 - Industrial Launderers ,
"ENDLESS Designs Picture Framing, Inc.",Custom frames; glass; mats; mount press; shrink wrap; prints; and volume orders   ,MWBE,SLBE,,false,true,791 Tremont Street Boston MA 02118,Boston,MA,02118,Ms. Linda Diaz,Owner,(617) 516-6138,,,Profit,false,2010,Under 10,AD - Advertising/Audovisual Graphic Design/Marketing Public Relations,,,,423220 - Home Furnishing Merchant Wholesalers ,
"Energy Engineering and Design, Inc.",Consulting engineering services related to efficient operation of mechanical systems in buildings   ,,SBE,VOSB,false,true,835 East Street Dedham MA 02026,Dedham,MA,02026,Mr. David Ward,President,(781) 775-2698,,david@energyengineeringinc.com,Profit,false,2001,Under 10,"COA - Consultants: Architecture, Engineering",AE - Architects/Engineers,,541330 - Engineering Services,541350 - Building Inspection Services,541620 - Environmental Consulting Services
