company_name,services_provided,mbe_wbe_cert,small_local_cert,veteran_cert,sdo_cert,has_bais_id,address,city,state,zipcode,contact_name,contact_title,phone,fax,email,business_type,construction,year_established,number_employees,business_area_1,business_area_2,business_area_3,naics_1,naics_2,naics_3
"J & J Const.  Architectural Woodwork, Inc.","Installation of millwork, casework and interior finished carpentry   ",MBE,SBE,,true,false,42 Mockingbird Way East Taunton MA 02178,East Taunton,MA,02178,Mr. Joseph E Morson,President,(508) 967-7993,(508) 822-6646,mrjoboss@aol.com,Profit,true,1990,10-20,CA - Carpentry,GC - General Contractors,CE - Construction Estimating,238350 - Finish Carpentry Contractors,,
J & J Professional Services,Credit repair; credit counseling; modifications; community work for teens   ,MWBE,SLBE,,false,false,18 Arborcrest Terrace Mattapan MA 02126,Mattapan,MA,02126,Ms. Laugenia Joyner,Owner,(617) 869-4994,(617) 698-0876,divagina2006@gmail.com,Profit,false,,Under 10,AA - Accountants,COM - Consultants: Management,BA - Banking/Financial Services,522390 - Other Activities Related to Credit Intermediation ,,
Johansson Design Collaborative,Landscape architecture design services   ,WBE,SBE,,true,false,9 Old Concord Road Lincoln MA 01773,Lincoln,MA,01773,Ms. Sonja Johansson,President,(781) 259-9701,(781) 259-9701,johanssondesign@gmail.com,Profit,false,1978,Under 10,"LD - Landscaping (Design, Architects)",,,541320 - Landscape Architectural Services,,
"John B. Cruz Construction Company, Inc.","General contractors specializing in construction management, estimating and carpentry   ",MBE,SLBE,,true,true,One John Elliot Square Roxbury MA 02119,Roxbury,MA,02119,"Mr. John B Cruz, III",,(617) 445-6901,(617) 442-2496,jbcruz3@cruzcompanies.com,Profit,true,1970,10-20,GC - General Contractors,CN - Construction Management: Small Commercial Projects,CE - Construction Estimating,236115 - New Single-Family Housing Construction (except For-Sale Builders) ,236116 - New Multifamily Housing Construction (except For-Sale Builders) ,237210 - Land Subdivision 
"John F. Shea Company, Inc.",Roofing; architectural sheetmetal; waterproofing; and historical roofing   ,WBE,SLBE,,false,true,41 Hollingsworth Street Mattapan MA 02126,Mattapan,MA,02126,Mr. Josh David,President,(617) 298-0356,(617) 296-8859,mshea@johnfshea.com,Profit,true,1917,41-100,"RF - Roofing, Sheet Metal Contractors",,,238160 - Roofing Contractors ,238390 - Other Building Finishing Contractors,
"John Leonard Employment Services, Inc.","Temporary and direct-hire staffing specializing in administrative, clerical and accounting personnel   typists, and other skilled personnel",WBE,SLBE,,true,true,75 Federal Street Boston MA 02110,Boston,MA,02110,Ms. Linda W Poldoian,President,(617) 423-6800,(617) 423-3943,dmckinley@johnleonard.com,Profit,false,1969,10-20,"EM - Employement (see also OS, TR)","OS - Office Services (Clerical Support, Employment, Court Reporting, Typing, etc., see also EM)",COG - Consultants: Human Resources,561311 - Employment Placement Agencies ,561320 - Temporary Help Services,
Johnson Pope Consulting,Consulting; marketing and communications; training; administrative and general management; and creative production and advertising   ,MWBE,,,true,false,100 Arlington Street Boston MA 02116,Boston,MA,02116,Ms. Enid Pope,Owner,(703) 862-5856,,madampope312@gmail.com,Profit,false,2016,Under 10,BU - Business Management Consultants,COP - Consultants: Public Relations,AD - Advertising/Audovisual Graphic Design/Marketing Public Relations,541611 - Administrative Management and General Management Consulting Services ,541613 - Marketing Consulting Services ,541810 - Advertising Agencies
John Tile and Marble,"Installation and restoration of tile, marble and brick pavers   ",MBE,SLBE,,false,false,52 Francis Street Boston MA 02115,Boston,MA,02115,Mr. John Dawkins,Owner,(617) 372-4387,,johntileandmarble4@gmail.com,Profit,true,2016,Under 10,"FL - Floor Contractors (Carpet, Tile, Linoleum)",CM - Concrete & Masonry Contractors,,238340 - Tile and Terrazzo Contractors,238330 - Flooring Contractors,238140 - Masonry Contractors 
Jolly Rogues,Musical entertainers   ,,SBE,,false,false,404 Main Street Wilmington MA 01887,Wilmington,MA,01887,Mr. James Murray,,(508) 574-3104,,,Profit,false,,Under 10,AD - Advertising/Audovisual Graphic Design/Marketing Public Relations,,,711130 - Musical Groups and Artists ,,
"Joseph & Sons Construction Company, Inc.",Carpentry; masonry   ,MBE,,,true,false,260 Hermitage Drive Springfield MA 01129,Springfield,MA,01129,Adrian Joseph,President,(413) 783-1697,,,Profit,true,1954,Under 10,CM - Concrete & Masonry Contractors,,,,,
"J & S Valve, Inc.",Manufacturers of valves for pipeline flow control   ,WBE,SBE,,false,false,2323 1st Street Huffman TX 77336,Huffman,TX,77336,Ms. Stacie Bolender,CEO,(281) 324-3990,(281) 324-4595,smb@jandsvalve.com,Profit,true,2004,Under 10,MU - Manufacturers,SU - Suppliers,,332919 - Other Metal Valve and Pipe Fitting Manufacturing ,,
"J. Thibert Architectural Woodwork Installation, Inc.",Finish carpentry   ,WBE,,,true,false,44 North Street Wilmington MA 01887,Wilmington,MA,01887,Ms. Lucia Thibert,Owner,(617) 359-8330,,juciafthibert@icloud.com,Profit,true,2016,Under 10,CA - Carpentry,,,238350 - Finish Carpentry Contractors,,
"K-9 Mercantile Protection, Inc.",Armed and unarmed security guards; canine teams; special event security; private investigations   ,MWBE,SBE,,true,false,PO. Box 3673 Plymouth MA 02361,Plymouth,MA,02361,Ms. Tiffony Cesero,President,(508) 250-2259,(508) 224-8581,k9protec@aol.com,Profit,false,1981,41-100,"SE - Security (Guards, Dogs, Systems)",,,561611 - Investigation Services ,561612 - Security Guards and Patrol Services ,
"Kang Associates, Inc.",Architectural services   ,MWBE,,,true,true,1602 B Concord Street Framingham MA 01701,Framingham,MA,01701,Ms. Kaffee Kang,President,(978) 443-6383,,,Profit,false,1986,Under 10,AE - Architects/Engineers,"COA - Consultants: Architecture, Engineering",COD - Consultants: Design,,,
"Karp Strategies, LLC",A community-economic development and urban planning strategy consulting firm,WBE,SBE,,false,false,"833 President Street, Apt. 3 Brooklyn NY 11215",Brooklyn,NY,11215,Ms. Rebecca Karp,Managing Principal and CEO,(718) 490-1431,,rebecca@karpstrategies.com,Profit,false,2015,10-20,COB - Consultants: City Planning,EC - Economic Development,COM - Consultants: Management,"541990 - All Other Professional, Scientific, and Technical Services",,
Kennedy & Violich Architecture,Architectural design services   ,MBE,SLBE,,true,true,10 Farnham Street Boston MA 02119,Boston,MA,02119,Mr. Juan Violich,Vice President,(617) 442-0800,,fviolich@kvarch.net,Profit,false,1988,Under 10,AE - Architects/Engineers,"COA - Consultants: Architecture, Engineering",,541310 - Architectural Services,541410 - Interior Design Services,
"Keville Enterprises, Inc.",Construction management; construction inspection   reporting; purchasing agent,WBE,,,true,true,475 School Street Marshfield MA 02050,Marshfield,MA,02050,Ms. Christine M Keville,President,(781) 837-3884,(781) 837-4091,ckeville@keville.com,Profit,false,1991,41-100,CN - Construction Management: Small Commercial Projects,"AS - Architectural Support Services, Surveying","COA - Consultants: Architecture, Engineering",236220 - Commercial and Institutional Building Construction ,237990 - Other Heavy and Civil Engineering Construction ,"541990 - All Other Professional, Scientific, and Technical Services"
"Kiessling Transit, Inc.",Transportation of elderly and handicapped individuals; fixed route; on demand response; para transit   ,WBE,,,true,false,194 Dedham Street Norfolk MA 02056,Norfolk,MA,02056,Ms. Paula Kiessling,President,(508) 384-5701,(508) 384-5193,lkiessling@kiesslingtransit.com,Profit,false,1989,Over 100,"TR - Travel, Transportation (Travel Agencies, Planning, Limo Services)",,,485991 - Special Needs Transportation ,485999 - All Other Transit and Ground Passenger Transportation ,
King and Khan Affordable Partnership,Painting; tiling   ,MBE,,,false,false,21 Greenville Street  Boston MA 02119,Boston,MA,02119,Mr. George D King,Owner,(617) 652-8116,(617) 652-8214,kingandkhancorp63@yahoo.com,Profit,true,1996,Under 10,PA - Painting and Papering Contractors,,,238320 - Painting and Wall Covering Contractors,238340 - Tile and Terrazzo Contractors,238350 - Finish Carpentry Contractors
KJK Contracting and Construction Company,Contracting of construction; remodeling; rehab; demo; brick and masonry; carpentry; painting; site survey; excavation; all phases of construction and maintenance   ,,SLBE,,false,true,176 Sydney Street Dorchester MA 02125,Dorchester,MA,02125,Mr. Kevin Kelly,Owner,(857) 312-9879,(617) 298-0461,kjkconstruction67@yahoo.com,Profit,true,2009,Under 10,CA - Carpentry,CM - Concrete & Masonry Contractors,CE - Construction Estimating,238350 - Finish Carpentry Contractors,238140 - Masonry Contractors ,238110 - Poured Concrete Foundation and Structure Contractors 
K & K Cleaning,Residential and commercial cleaning company   ,MWBE,SLBE,,false,true,414 Norfolk Street Dorchester MA 02124,Dorchester,MA,02124,Ms. Kimberlin Broglin,Owner,(617) 704-2719,,kimberlin617@gmail.com,Profit,false,2016,Under 10,"JA - Janitorial Services/Supplies (see also MA, RS)","MA - Maintenance (Industrial, Commericial, Residential, see also JA, RS)",,561720 - Janitorial Services ,,
"K.L.N. Construction Co., Inc.",Drywall and metal stud framing;  vinyl exterior shutter sales   ,WBE,,,true,false,70 Bridge Street Pelham NH 03076,Pelham,NH,03076,Karen L Nicolls,President,(603) 635-0807,(603) 635-0806,,Profit,true,1989,Under 10,"PL - Plastering, Drywall Contractors",,,,,
"Kripper Archictural Studio, Inc.",Architecture and interior design services   ,,SLBE,,false,false,36 Bromfield Street Boston MA 02108,Boston,MA,02108,Mr. Amir Kripper,President,(617) 993-6093,,amir@kripperstudio.com,Profit,false,2012,Under 10,AE - Architects/Engineers,IT - Interior Deisgn Services,,541310 - Architectural Services,,
"K & S Builders, Inc.","General construction; demolition, selective demolition; site work; drywall; flooring; ceiling; painting; millowrk; and rough carpentry   ",MBE,SBE,,true,false,399 Old Connecticut Path Wayland MA 01778,Wayland,MA,01778,Mr. Sajid M Lateef,President,(508) 245-3097,(508) 545-0605,sajid@ksbuilders.org,Profit,true,2003,Under 10,GC - General Contractors,"SI - Sitework (Excavation, Demolition, Utilities, Sewage, see also GC)",,236220 - Commercial and Institutional Building Construction ,236117 - New Housing For-Sale Builders ,238910 - Site Preparation Contractors
"Kyran Research Associates, Inc.","Computer consultants; computer analysis and programming, documentation, training   ",WBE,,,true,true,127 John Clarke Road Middletown RI 02842,Middletown,RI,02842,Ms. Nancy E Whitehead,President,(401) 849-7734,(401) 846-3832,,Profit,false,1980,21-40,"CP - Computer (Hardware, Software, Design, Data Processing (see also COS, COT)",COS - Consultants: Systems Analysis,,,,
"La Alianza Hispana, Inc.",Social services:  mental health; advocacy; counseling; adult day health services; youth after school programs; ESOL workforce development and community outreach diversified array of needed services to the Hispanic community in Boston ,MBE,,,true,true,409 Dudley Street Roxbury MA 02119,Roxbury,MA,02119,Mr. William Rodriguez,Executive Director,(617) 427-7175,(617) 442-2259,,Not-for-Profit,false,1970,41-100,"ED - Education (see also OS, TA)",ES - Elderly Services,CC - Childcare,624120 - Services for the Elderly and Persons with Disabilities ,624110 - Child and Youth Services ,
La Fete Catering,Catering service   ,,SBE,,false,false,148 East Central Street Natick MA 01760,Natick,MA,01760,Ms. Margaret Nichols,Owner,(508) 655-2431,(508) 655-2457,lafetecatering@lafetecatering.com,Profit,false,,21-40,CT - Catering,,,722320 - Caterers,,
L & A Future Corporation dba Supreme Paint,"Supplier of paint, wallcovering, mortar and related materials   ",WBE,SBE,,false,false,729 Broadway Somerville MA 02144,Somerville,MA,02144,Mr. Steve Boraks,Manager,(617) 547-7290,(617) 547-7826,sboraks@city-paint.com,Profit,true,1997,Under 10,SU - Suppliers,RT - Retail Sales of Art & Framing,PA - Painting and Papering Contractors,444130 - Hardware Stores ,,
"Lanco Scaffolding, Inc.",Erecting and dismantling of scaffolding   ,MBE,SBE,,true,true,33 Earle Street Somverville MA 02143,Somverville,MA,02143,Mr. Carlos Gomez,President,(617) 623-0060,(617) 776-9260,,Profit,true,1984,21-40,EP - Equiment Rental (Heavy Construction),GC - General Contractors,,238990 - All Other Specialty Trade Contractors,,
Las Palmas Restaurant,Catering services,MWBE,SLBE,,false,true,4337A Washington Street Roslindale MA 02131,Roslindale,MA,02131,Ms. Seila Green,Owner,(617) 869-3865,,laspalmasrest@icloud.com,Profit,false,2016,Under 10,CT - Catering,,,722320 - Caterers,,
Law Offices of Jennifer R. DeFeo,Professional Legal Services   ,WBE,SLBE,,false,true,10 Bremen Street East Boston MA 02128,East Boston,MA,02128,Ms. Jennifer DeFeo,owner,(617) 561-0151,,,Profit,false,1995,Under 10,AT - Attorneys,,,,,
Law Offices of John R. Shek,Legal services   in court,MBE,SLBE,,true,false,141 Tremont Street Boston MA 02111,Boston,MA,02111,Mr. John R Shek,Principle,(617) 723-1223,(617) 742-5734,,Profit,false,1988,Under 10,AT - Attorneys,,,,,
LeadWell Partners (dba LWP),Strategic advisory and management consultant   ,WBE,SLBE,,false,false,77 Exeter Street Boston MA 02116,Boston,MA,02116,Dr. Elizabeth Reilinger,Founder and Managing Director,(617) 838-2973,,ereilinger@leadwellpartners.com,Profit,false,2008,Under 10,COM - Consultants: Management,COS - Consultants: Systems Analysis,COD - Consultants: Design,541611 - Administrative Management and General Management Consulting Services ,541511 - Custom Computer Programming Services ,541720 - Research and Development in the Social Sciences and Humanities 
"Legacy International Trucking, LLC",Freight delivery/transportation,MBE,SLBE,,false,false,171 Wilmington Avenue Boston MA 02124,Boston,MA,02124,Mr. Demark Davis,Owner,(857) 334-0429,,legacyinternationaltruckingllc@gmail.com,Profit,false,2020,Under 10,TK - Trucking (Waste Disposal Commodities Transport),,,"484110 - General Freight Trucking, Local ",,
"L & H Plumbing Company, Inc.",Plumbing and minor heating; backflow prevention services and testing  ,MBE,SLBE,,true,false,90  West Cottage Street Boston MA 02125,Boston,MA,02125,Joseph D Hurley,Mr.,(617) 445-2937,,,Profit,true,1990,Under 10,PB - Plumbing,"ME - Mechanical Contractors (HVAC, Plumbing, Insulation, Service, see also GC, PB)",COD - Consultants: Design,,,
Light Life Massage,"On-site massage therapy, Reiki, meditation, EFT tapping (stress release and deep relaxation technique)   ",WBE,,,false,false,38 Holmes Street Carver MA 92330,Carver,MA,92330,Ms. Joanne Salerno,Owner,(339) 832-2196,,llm@myabmp.com,Profit,false,2007,Under 10,"AHS - Health Care (Providers, Services)",,,621330 - Offices of Mental Health Practitioners (except Physicians) ,621399 - Offices of All Other Miscellaneous Health Practitioners ,812990 - All Other Personal Services 
"Lin Associates, Inc.",Consulting engineers--structural engineering services and construction administration ,MBE,SLBE,,true,true,2001 Beacon Street Brighton MA 02135,Brighton,MA,02135,Mr. Daniel Deng,Principal,(617) 566-4216,(617) 566-6038,info@linboston.com,Profit,false,1978,10-20,"COA - Consultants: Architecture, Engineering",COU - Consultants: Transportation,,541330 - Engineering Services,,
"Linea 5, Inc.",Architecture and engineering services   ,WBE,,,false,true,22 Batterymarch Street Boston MA 02109,Boston,MA,02109,Ms. Jennifer Hite,Principal,(617) 723-8808,(617) 723-8898,jgarcia@linea5.com,Profit,false,1985,21-40,AE - Architects/Engineers,,,541310 - Architectural Services,541330 - Engineering Services,
"LingoCo, LLC",Language and education testing and consulting   ,WBE,SLBE,,false,false,130 Bowdoin Street Boston MA 02108,Boston,MA,02108,Ms. Amanda Potasznik,,(857) 245-5639,,info@lingoco.com,Profit,false,2017,Under 10,"ED - Education (see also OS, TA)",COV - Consultants: Translation,MO - Multi Service Organizations,611630 - Language Schools ,611710 - Educational Support Services,561410 - Document Preparation Services
"Livs Transportation, Inc.","Waste hauler, including commercial, residential, and construction site; container rental for waste or storage   ",WBE,SBE,,false,false,108 Homestead Lane Hanover MA 02339,Hanover,MA,02339,Ms. Carolyn P Mowbray,President,(781) 844-1476,(781) 834-0004,,Profit,true,,Under 10,EP - Equiment Rental (Heavy Construction),,,532490 - Other Commercial and Industrial Machinery and Equipment Rental and Leasing ,,
"L & K Trucking, Inc.","Snow plowing; excavation; paving; and oil tank removal, above and underground   ",MBE,,,true,true,1 Whipple Road Peabody MA 01960,Peabody,MA,01960,Mr. Landford D Huff,Owner,(978) 771-9352,,katrina@landktrucking.com,Profit,true,1987,Under 10,"SI - Sitework (Excavation, Demolition, Utilities, Sewage, see also GC)",SN - Snow Removal/Plowing (see also TK),TK - Trucking (Waste Disposal Commodities Transport),,,
"L. Martinez Construction, Inc.",Demolition and final clean up   ,MBE,,,false,true,237 Bennington Street East Boston MA 02128,East Boston,MA,02128,Mr. Leonel Martinez,President,(617) 331-7270,(617) 507-0289,,Profit,true,2002,Under 10,"SI - Sitework (Excavation, Demolition, Utilities, Sewage, see also GC)",,,238910 - Site Preparation Contractors,,
"Logan Communications International, Inc.","Provide business and independent professionoals with the resources, support and tools needed for sustained success and growth   ",,SLBE,,false,false,P.O. Box 549 East Boston MA 02128,East Boston,MA,02128,Ms. Hajar Abdurrahim-Logan,,(617) 569-8720,,,Profit,false,1999,Under 10,"OS - Office Services (Clerical Support, Employment, Court Reporting, Typing, etc., see also EM)",MK - Marketing,,561210 - Facilities Support Services,,
Long Bay Management Company,Real estate and development company   construction management,MBE,SLBE,,false,false,451 Blue Hill Avenue Dorchester MA 02121,Dorchester,MA,02121,Ms. Lisa Guscott,Owner's representative,(617) 259-1890,(617) 989-1253,lguscott@longbaymgt.com,Profit,true,2006,Under 10,"JA - Janitorial Services/Supplies (see also MA, RS)","MA - Maintenance (Industrial, Commericial, Residential, see also JA, RS)",,531311 - Residential Property Managers ,,
"LOOP Capital Markets, LLC",Investment banking and securities brokerage brokerage  ,MBE,,,false,false,111 W. Jackson Chicago IL 60604,Chicago,IL,60604,Mr. Stephen Berkeley,Chief Compliance Officer,(312) 913-2225,(312) 913-4928,,Profit,false,1997,Over 100,BA - Banking/Financial Services,,,523120 - Securities Brokerage ,,
"Lotus Designs, Inc.",Retail flower shop; weddings and special events; florist   ,MBE,SLBE,,false,false,977 Tremont Street Boston MA 02120,Boston,MA,02120,Mr. Khetporn Palakavong,President,(617) 262-7031,(617) 236-1179,knaayutaya@aol.com,Profit,false,1995,Under 10,"FO - Floral (Arrangement, Maintenance)",RT - Retail Sales of Art & Framing,,453110 - Florists ,,
Lowe Plumbing & Heating,Plumbing and heating contractors   ,MBE,SLBE,,false,true,90 West Cottage Street Dorchester MA 02125,Dorchester,MA,02125,Mr. Eugene Lowe,Owner,(617) 541-3446,,,Profit,false,1996,Under 10,PB - Plumbing,,,,,
Luna Design Group,Architectural design; interior and planning; planning and handicap accessibility services   ,MBE,SBE,,true,true,100 Conifer Hill Drive Danvers MA 01923,Danvers,MA,01923,"Mr. Joseph L Luna, AIA",Owner,(781) 245-6530,(781) 245-6508,,Profit,false,1990,Under 10,AE - Architects/Engineers,"COA - Consultants: Architecture, Engineering",COB - Consultants: City Planning,541310 - Architectural Services,,
"LXC Engineering Group, LLC","Engineering services, including MEP and F Consultant, Electrical Design, Forensic Analysis and Commissioning services to updrade existinf and new buildin new smart digital infrastructure on modern power systems   ",MBE,SLBE,,true,false,1532B Dorchester Avenue Boston MA 02122,Boston,MA,02122,Mr. Louis Chrispin,Principal Engineer,(3) 059-8819,(857) 366-6389,lchrispin@lxceg.com,Profit,false,2018,Under 10,AE - Architects/Engineers,"COA - Consultants: Architecture, Engineering",COD - Consultants: Design,,541330 - Engineering Services,541350 - Building Inspection Services
"M & A Architectural Preservation, Inc.","Finish carpentry contractor:  restoration,  windows and doors   ",WBE,SBE,,true,false,433 Market Street Lawrence MA 01843,Lawrence,MA,01843,Ms. Susan G Muckle,President,(978) 683-0880,(978) 683-8370,suemuckle@archpres.com,Profit,true,1991,10-20,CA - Carpentry,CM - Concrete & Masonry Contractors,GC - General Contractors,236220 - Commercial and Institutional Building Construction ,238350 - Finish Carpentry Contractors,238150 - Glass and Glazing Contractors 
"Mabbett & Associates, Inc.",Environmental engineering and planning; site assessment and remediation; occupational safety and health; environmental compliance and management; environmental health and safety training   ,,SBE,SDVOSB,true,false,5 Alfred Circle Bedford MA 01730,Bedford,MA,01730,Mr. Arthur N Mabbett,,(781) 275-6050,(781) 275-2557,mabbett@mabbett.com,Profit,false,1980,,"EN - Environmental Consultants ( Planning, Soil Boring, Hazardous Waste Treatment, etc.)",CON - Consultants: Environmental,TA - Training (see also ED),562910 - Remediation Services ,541330 - Engineering Services,
MacKenzie Painting Company,"Painting contractor:  painting, wall covering, epoxy flooring and spray-on fireproofing   ",WBE,,,false,false,60 Mead Street Stratford CT 06615,Stratford,CT,06615,Ms. Margaret M Cumings,President,(203) 380-9000,(203) 386-9507,m.cumings@themackenziecos.com,Profit,true,1990,21-40,PA - Painting and Papering Contractors,"PC - Protective Coverings (Water and Fireproofing, Special Coverings/Coatings)","ER - Exterior Restoration, Sandblasting (Anti-Graffiti)",238320 - Painting and Wall Covering Contractors,,
Maid in the Shade,Cleaning services; maintenance and janitorial services,WBE,SLBE,,false,false,30 Fenwood Road Boston MA 02115,Boston,MA,02115,Ms. Kerrie Felton,Owner,(617) 713-4242,,maidintheshadecleaning@outlook.com,Profit,false,2002,Under 10,"JA - Janitorial Services/Supplies (see also MA, RS)",,,561720 - Janitorial Services ,,
"Mainsail Group, Inc.",Professional services; program and project management; administrative support; IT support.  This is a Service Disabled Veteran Owned Small Business Enterprise (SDVOSBE).   ,,SBE,SDVOSB,false,false,200 Hanscom Drive Bedford MA 01730,Bedford,MA,01730,Ms. Laura Penders,CEO,(508) 745-3195,(508) 358-3569,ldpenders@mainsailgroupinc.com,Profit,false,2013,,"OS - Office Services (Clerical Support, Employment, Court Reporting, Typing, etc., see also EM)","CP - Computer (Hardware, Software, Design, Data Processing (see also COS, COT)",,519190 - All Other Information Services,561990 - All Other Support Services,
Make It Personal Designs,Custom embroidery services   ,MWBE,SLBE,,false,true,6B Herman Street Roxbury MA 02119,Roxbury,MA,02119,Ms. Lisa Martin,Owner,(617) 445-0424,(617) 445-0424,sales@makeitpersonaldesigns.ws,Profit,false,2005,Under 10,AL - Apparel,,,,,314999 - All Other Miscellaneous Textile Product Mills 
"Malbay Consulting, Inc.",Community relations and public affairs,WBE,SLBE,,false,false,"84 Train Street, #2 Dorchester MA 02122",Dorchester,MA,02122,Ms. Kate Kelly,President,(508) 479-7884,,kate@malbayconsulting.com,Profit,false,2017,Under 10,COP - Consultants: Public Relations,"RE - Real Estate (Development, Management, Sales and Appraisals)",,541820 - Public Relations Agencies,531390 - Other Activities Related to Real Estate ,
"Mansfield Travel, Inc.",Travel consulting; full service travel agency; leisure and corporate travel services ,WBE,,,true,true,P.O. Box 1284 Mansfield MA 02048,Mansfield,MA,02048,Cynthia A DeMarco,President,(508) 339-0090,(508) 339-0439,,Profit,false,1992,Under 10,"TR - Travel, Transportation (Travel Agencies, Planning, Limo Services)",COU - Consultants: Transportation,"AU - Automobile (Sales, Services, Leasing, Rental)",,,
Marilyn Humphries Photography,"Editorial and event photography; annual reports, portrait photography; new, stock and location photography   ",WBE,SBE,,true,true,6 Brimbal Hills Drive Beverly MA 01915,Beverly,MA,01915,Ms. Marilyn L Humphries,Photographer/Owner,(978) 921-1633,(978) 921-5935,mhumphries@nii.net,Profit,false,1988,Under 10,PG - Photography,,,"541921 - Photography Studios, Portrait ",541922 - Commercial Photography ,
Market International Insurance Agency,Commercial property and casualty insurance broker   specifications preparations,MWBE,SBE,,true,false,183 Columbia Road Hanover MA 02339,Hanover,MA,02339,Ms. Lisel Garcia,Principal,(781) 834-3311,(781) 834-3322,lgarcia@marketinternational.com,Profit,false,1997,Under 10,IN - Insurance Agencies (see also COI),COI - Consultants: Insurance & Financial,FI - Financial Services (see also BA and COI),,,
"Marley Environmental, Inc.","Environmental consulting (Phase I site assessment, Phase II investigations, remediation oversight)   ",WBE,,,true,false,P.O. Box 1765 Avon CT 06001,Avon,CT,06001,Ms. Martha Lemmon,President/CEO,(203) 831-0123,(203) 838-6410,mlemmon@marleyenvironmental.com,Profit,false,1994,Under 10,"EN - Environmental Consultants ( Planning, Soil Boring, Hazardous Waste Treatment, etc.)",CON - Consultants: Environmental,HW - Hazardous Waste Management (see also EN and CON),,,
"Mass Construction and Management, Inc.",General contractor; construction and construction management   ,MBE,SLBE,,true,true,34 Cedar Street Rear Mattapan MA 02126,Mattapan,MA,02126,Mr. Maxime Charles,President,(781) 885-7162,(781) 885-7260,mcharles@massconstruct.com,Profit,true,2007,41-100,CN - Construction Management: Small Commercial Projects,GC - General Contractors,CA - Carpentry,236118 - Residential Remodelers ,236220 - Commercial and Institutional Building Construction ,238130 - Framing Contractors 
