company_name,services_provided,mbe_wbe_cert,small_local_cert,veteran_cert,sdo_cert,has_bais_id,address,city,state,zipcode,contact_name,contact_title,phone,fax,email,business_type,construction,year_established,number_employees,business_area_1,business_area_2,business_area_3,naics_1,naics_2,naics_3
Nova Sheen Corporation,"Floor contractor/supply and installation carpet, tile, vinyl and rubber stair goods, vinyl sheet goods, vertical and horizontal v-blinds",MBE,SLBE,,true,true,P.O. Box 123 Boston MA 02121,Boston,MA,02121,"Mr. Don Straughter, Jr.",Owner,(617) 442-0488,(617) 442-0489,,Profit,true,1957,Under 10,"FL - Floor Contractors (Carpet, Tile, Linoleum)","DU - Draperies, Upholstery (Custom)","CL - Commercial Dry Cleaning, Laundry",,,
Nuestra Comunidad Development Corp.,"Mixed-income for-sale housing; low-income rental housing, construction and management; counseling services for home owners and buyers   management",MBE,,,false,true,56 Warren Street Roxbury MA 02119,Roxbury,MA,02119,Mr. David Price,Executive Director,(617) 989-1223,(617) 989-1216,dprice@nuestracdc.org,Not-for-Profit,false,,21-40,EC - Economic Development,HO - Housing Advocacy,"RE - Real Estate (Development, Management, Sales and Appraisals)",624190 - Other Individual and Family Services ,813319 - Other Social Advocacy Organizations ,925120 - Administration of Urban Planning and Community and Rural Development 
Numit Technologies LLC,IT consulting services   ,MBE,,,true,true,40 Mechanic Street Marlborough MA 01752,Marlborough,MA,01752,Mr. Lakshmikanta Laikangbam,President,(207) 632-1926,(508) 925-4704,lakshmikanta.laikangbam@numittech.com,Profit,false,2015,Under 10,"CP - Computer (Hardware, Software, Design, Data Processing (see also COS, COT)",COS - Consultants: Systems Analysis,,541511 - Custom Computer Programming Services ,,
"NXTevent, Inc.",Special event design; transportation management; airport meet and greet; dine arounds; hospitality management; tour programs; excursions; entertainment   ,WBE,SLBE,,true,true,60 K Street Boston MA 02127-1568,Boston,MA,02127-1568,Ms. Allyson O'Connor,CEO and Founder,(617) 904-9050,(617) 307-6257,ally@nxtevent.com,Profit,false,,Under 10,AD - Advertising/Audovisual Graphic Design/Marketing Public Relations,,,561920 - Convention and Trade Show Organizers,541613 - Marketing Consulting Services ,
Obbagy Consulting,Executive environmental and social leadership; qualitive environmental and social risk assessments   ,WBE,SBE,,true,true,28 Lenox Street Newton MA 02465,Newton,MA,02465,Ms. Jane Obbagy,Managing Director,(617) 921-1515,,jeo@obbagyconsulting.com,Profit,false,2015,Under 10,"EN - Environmental Consultants ( Planning, Soil Boring, Hazardous Waste Treatment, etc.)",BU - Business Management Consultants,,541620 - Environmental Consulting Services,541618 - Other Management Consulting Services ,
"Occusafe, Inc.","Occupational Safety/OSHA compliance training; distributor of safety equipment and supplies response, confined space extry safety & rescue, fork lift training & skill as- sessment; health & safety audits; etc.",WBE,SBE,,false,false,135 Mountain View Drive Belchertown MA 01007,Belchertown,MA,01007,Diane C Malachowski,President,(413) 323-1036,(413) 323-1039,,Profit,false,1995,Under 10,TA - Training (see also ED),SA - Safety Products,"ED - Education (see also OS, TA)",541620 - Environmental Consulting Services,,
O Donnell Sand & Gravel,"Suppliers: sand, gravel, crushed, washed stone, sitework, equipment rental, stump grinding and stone crushing opera- tion",WBE,SBE,,true,false,54 Grove Street Kingston MA 02364,Kingston,MA,02364,Ms. Mary K O'Donnell,President/Treasurer,(617) 688-6088,,mary@nofossilfuel.com,Profit,true,1984,Under 10,MU - Manufacturers,SU - Suppliers,TK - Trucking (Waste Disposal Commodities Transport),212321 - Construction Sand and Gravel Mining ,212322 - Industrial Sand Mining ,238910 - Site Preparation Contractors
"Off-Piste Design, Inc","Graphic design; copy writing and editing, publication design illustration, production; consulting and vendor handling ",WBE,SBE,,false,false,1165R Massachusetts Avenue Arlington MA 02476,Arlington,MA,02476,Thomas D Skehan,Mr.,(781) 646 1100,(781) 646 1130,,Profit,false,1997,Under 10,AD - Advertising/Audovisual Graphic Design/Marketing Public Relations,COD - Consultants: Design,COE - Consultants: Editorial,541430 - Graphic Design Services,541890 - Other Services Related to Advertising ,
"Oil Management Services, Corp.",Lubricant/petroleum product distributer; petroleum system maintenance; oil tank removal and installation; vehicle lifts and appurtenances; City of Boston G-12 license.  This is a Service Disabled Veteran Owned Small Business Enterprise (SDVOSBE).   ,,SBE,SDVOSB,false,true,201 Maquan Street Hanson MA 02341,Hanson,MA,02341,Mr. Dale Dennison,President,(617) 799-1335,(781) 293-5492,brenda@oms-corp.net,Profit,false,2009,,PP - Petroleum Products (Sales/Service),,,,,
"OKW, Inc.",Design and manufacturing of women's clothing  ,MBE,SLBE,,false,false,631 Tremont Street Boston MA 02118,Boston,MA,02118,Ms. Waheeda Ali-Salaam,owner,(617) 266-4114,(617) 266-6182,,Profit,false,1987,Under 10,AL - Apparel,,,,,
"Olmstead Associates, LLC",A boutique consultancy focused on driving operational agility into the investment management industry using a unique data-centric approach,,SLBE,,false,false,185 Devonshire Street Boston MA 02110,Boston,MA,02110,Mr. Stephen Alepa,CFO,(617) 807-6058,,alepa@olmst.com,Profit,false,1995,10-20,COM - Consultants: Management,COI - Consultants: Insurance & Financial,BU - Business Management Consultants,541611 - Administrative Management and General Management Consulting Services ,"541990 - All Other Professional, Scientific, and Technical Services",
"Omega World Travel, Inc.","Complete travel management services including air, hotel, car rail bookings; online booking tools and T & E solutions   ",WBE,,,false,false,3102 Omega Office Park Fairfax MA 22031,Fairfax,MA,22031,Ms. Gloria Bohan,President,(703) 359-0200,(703) 359-8889,proposals@owt.net,Profit,false,1972,Over 100,"TR - Travel, Transportation (Travel Agencies, Planning, Limo Services)",,,,,
"One Way Development, Inc.","General contractor specializing in remodeling, finish carpentry, interior and exterior painting   ",MBE,SLBE,,true,true,67 Kemble Street Roxbury MA 02119,Roxbury,MA,02119,Mr. Abraham Gonzalez,Owner,(617) 390-5469,(617) 390-5472,agonzalez@onewaydevelopment.com,Profit,true,2004,Under 10,GC - General Contractors,CA - Carpentry,PA - Painting and Papering Contractors,236118 - Residential Remodelers ,238350 - Finish Carpentry Contractors,238320 - Painting and Wall Covering Contractors
Only For You Design Concepts,Visual designer and interior design consultant   ,MWBE,SLBE,,false,false,68 Crawford Street Boston MA 02121,Boston,MA,02121,Ms. Crystal Glasford-Lodge,Owner,(617) 872-4769,,only4udesign@gmail.com,Profit,false,1998,Under 10,AD - Advertising/Audovisual Graphic Design/Marketing Public Relations,COD - Consultants: Design,,541410 - Interior Design Services,541490 - Other Specialized Design Services,
"OSA Services, Inc.","Accounting, bookkeeping, payroll, taxation services",MBE,SLBE,,false,false,"1773 Dorchester Avenue, Suite 2A Dorchester MA 02124",Dorchester,MA,02124,Dr. Osazee Owens,President,(617) 287-8877,(617) 282-5859,osaservicesinc@aol.com,Profit,false,2003,Under 10,AA - Accountants,,,541214 - Payroll Services ,541219 - Other Accounting Services ,
Outkast Electrical Contractors,"Electrical contractors, commercial and residential   ",MBE,SLBE,,false,false,39 Johnston Road Dorchester MA 02124,Dorchester,MA,02124,Mr. Paul Gray,President,(617) 822-0244,,paulgray39@msn.com,Profit,true,1997,Under 10,EL - Electrical Contractors,,,,,
"over,under Inc.",Architecture; interiors; urban and design; exhibit design; graphic identity; and publications   ,,SLBE,,false,true,46 Waltham St Boston MA 02118,Boston,MA,02118,Mr. Mark Pasnik,President,(617) 426-4466,(617) 507-2430,pasnik@overcommaunder.com,Profit,false,2006,Under 10,AE - Architects/Engineers,"COA - Consultants: Architecture, Engineering",COD - Consultants: Design,541310 - Architectural Services,,
"Owen Steel Company, Inc.",Structural steel fabrication and erection   ,MWBE,,,false,false,727 Mauney Drive Columbia SC 29201,Columbia,SC,29201,Ms. Anny Van Dam Zalesne,CEO,(803) 251-7556,(803) 251-7546,anny.zalesne@owensteel.com,Profit,true,2001,Over 100,"ST - Steel Contractos (Reinforcing, Erecting, see also FB, GC)",MU - Manufacturers,SU - Suppliers,332312 - Fabricated Structural Metal Manufacturing ,,
Pamela Perini Consulting,Security consultant; school security; K-12 security; campus security; commercial buildings; security and risk assessments; security design; low income housing security; elderly housing security; municipality security; transportation security; OPM; project   ,WBE,,,true,true,20 Freemont Terrace Waltham MA 02452,Waltham,MA,02452,Ms. Pamela Perini,Principal Security Consultant,(617) 447-0081,,pperini1234@hotmail.com,Profit,false,2009,Under 10,"SE - Security (Guards, Dogs, Systems)",,,561621 - Security Systems Services (except Locksmiths) ,,
"Paradyme Management, Inc.",IT consulting services; management consulting services; IT Financial consulting   ,MBE,SBE,,false,false,"3820 39th Street, NW Washington DC 20016",Washington,DC,20016,Mr. Viraj Gandhi,President,(202) 640-1276,(240) 965-4993,,Profit,false,2003,21-40,BU - Business Management Consultants,COM - Consultants: Management,COS - Consultants: Systems Analysis,541611 - Administrative Management and General Management Consulting Services ,541612 - Human Resources Consulting Services ,541690 - Other Scientific and Technical Consulting Services
"Paragon Landscape Construction, Inc.",Landscape construction   ,WBE,SBE,,true,true,62 Industrial Way Hanover MA 02339,Hanover,MA,02339,Ms. Stephanie A. Reid,President,(781) 834-1000,(781) 834-3331,sherry@paragonlandscape.com,Profit,true,1992,10-20,LA - Landscaping Contractors,,,238910 - Site Preparation Contractors,561730 - Landscaping Services,
"Parkway Real Estate, LLC",Real estate sales and leasing   ,WBE,SLBE,,false,false,2064 Centre Street West Roxbury MA 02132,West Roxbury,MA,02132,Ms. Danielle O'Brien,Owner,(617) 553-0192,(617) 553-0289,parkwayrellc@gmail.com,Profit,false,2014,Under 10,"RE - Real Estate (Development, Management, Sales and Appraisals)",RS - Residential Services,,531210 - Offices of Real Estate Agents and Brokers,531390 - Other Activities Related to Real Estate ,
"Parrish Painting, Development and Construction, Inc.","Painting, carpentry, construction, etc.   ",MBE,,,false,true,"6 Fayston Street, Suite 2  Boston, MA 02121 Boston MA 02121",Boston,MA,02121,Mr. John E Lee,President,(617) 515-8860,(617) 445-0476,parrislee@peoplepc.com,Profit,true,1975,Under 10,PA - Painting and Papering Contractors,GC - General Contractors,,238320 - Painting and Wall Covering Contractors,238350 - Finish Carpentry Contractors,238310 - Drywall and Insulation Contractors 
Patel Construction Company,"Construction Specializing in Carpentry, Drywall and Sitework, Construction Manag ment, Engineering and Architectural Su- pport Services.",MBE,,,true,false,27 Congress Salem MA 01970,Salem,MA,01970,Mr. Milan Patel,Owner,(978) 740-2765,,,Profit,true,1999,Under 10,"AS - Architectural Support Services, Surveying",CA - Carpentry,CN - Construction Management: Small Commercial Projects,,,
"Patricia A. Connors, Atttorney at Law",Legal services   ,WBE,SLBE,,true,true,33 Mount Vernon Street Boston MA 02108,Boston,MA,02108,Ms. Patricia A Connors,,(617) 227-7273,(617) 742-4953,attorneypatriciaconnors@gmail.com,Profit,false,1993,Under 10,AT - Attorneys,,,,,
Patricia Cleaning,"Residential, commercial and construction cleaning   ",MWBE,SBE,,false,false,31 Woodcock Avenue Haverill MA 01832,Haverill,MA,01832,Ms. Santa Sloane,Owner,(978) 645-1226,,patriciacleaning50@gmail,Profit,false,2016,Under 10,"JA - Janitorial Services/Supplies (see also MA, RS)","MA - Maintenance (Industrial, Commericial, Residential, see also JA, RS)",,561720 - Janitorial Services ,561790 - Other Services to Buildings and Dwellings ,561740 - Carpet and Upholstery Cleaning Services
Patricia Kennedy Communications,Public relations and marketing   ,WBE,SLBE,,false,false,103 Warren Avenue Boston MA 02116,Boston,MA,02116,Patricia Kennedy,Ms.,(617) 266-8394,(617) 797-2431,,Profit,false,2003,,AD - Advertising/Audovisual Graphic Design/Marketing Public Relations,COM - Consultants: Management,COP - Consultants: Public Relations,541820 - Public Relations Agencies,541613 - Marketing Consulting Services ,
Payne Contracting Company,Painting and drywall contractors; wallcovering; cleaning/janitorial services   ,MBE,SLBE,,false,false,34 Mallon Road Dorchester MA 02121,Dorchester,MA,02121,Ms. Rochelle Payne,Executive Assistant,(617) 892-2921,(617) 892-2921,rochelle@paynecontracting.com,Profit,true,,Under 10,PA - Painting and Papering Contractors,"JA - Janitorial Services/Supplies (see also MA, RS)",,238320 - Painting and Wall Covering Contractors,561720 - Janitorial Services ,
"PCC Technology Group, LLC","Information technology consultants specializing in eGovenment application development, System Navigation, augmentation/contract professionals",MBE,SBE,,true,true,2 Barnard Lane Bloomfield CT 06002,Bloomfield,CT,06002,Mr. Jerry W Long,President and CEO,(860) 242-3299,(860) 286-0459,,Profit,false,1995,41-100,"CP - Computer (Hardware, Software, Design, Data Processing (see also COS, COT)",,COS - Consultants: Systems Analysis,541511 - Custom Computer Programming Services ,541512 - Computer Systems Design Services ,
PCP Extraordinary Homecare,Homecare for the elderly and disabled   ,MWBE,SLBE,,false,false,2 Canaan Street Mattapan MA 02126,Mattapan,MA,02126,Ms. Patricia Paisley,Owner,(617) 296-1657,(617) 298-2497,p.p@extraordinaryhomecare.com,Profit,false,2012,Under 10,"AHS - Health Care (Providers, Services)",ES - Elderly Services,,621610 - Home Health Care Services,624190 - Other Individual and Family Services ,
"Peabody Properties, Inc.","Real estate management, development and brokerage; and resident services   ",WBE,,,true,true,536 Granite Street Braintree MA 02185,Braintree,MA,02185,Ms. Karen Fish-Will,President,(781) 794-1000,(781) 794-1001,karen@peabodyproperties.com,Profit,false,1976,Over 100,"RE - Real Estate (Development, Management, Sales and Appraisals)",RS - Residential Services,,,,
"Peak Technology Solutions, Inc.",IT/GIS services,MBE,SBE,,true,false,"1627 K Street, NW, Suite 400 Washington DC 20006",Washington,DC,20006,Mr. Mohammad Tariq,President,(202) 776-7196,(301) 260-2184,info@peaktsinc.com,Profit,false,2002,Under 10,"CP - Computer (Hardware, Software, Design, Data Processing (see also COS, COT)",COS - Consultants: Systems Analysis,COT - Consultants: Telecommunications,541511 - Custom Computer Programming Services ,541512 - Computer Systems Design Services ,541370 - Surveying and Mapping (except Geophysical) Services
"PeopleServe, Inc.","Employment services:  temporary and permanent staffing, specializing in information technology   services",WBE,SBE,,true,true,643 VFW Parkway Chestnut Hill MA 02467,Chestnut Hill,MA,02467,Ms. Linda Moraski,Owner,(617) 469-9779,(617) 363-0091,lmoraski@peopleserveinc.com,Profit,false,1999,41-100,"EM - Employement (see also OS, TR)","CP - Computer (Hardware, Software, Design, Data Processing (see also COS, COT)",COG - Consultants: Human Resources,561311 - Employment Placement Agencies ,561320 - Temporary Help Services,
"Perfect Curve, Inc.",Manufacturer and wholesaler of storage and organization accessories   ,,SLBE,,false,false,137 South Street South Boston MA 02111,South Boston,MA,02111,Mr. Gregg Levin,President,(617) 224-1600,(617) 224-1601,gregg@perfectcurve.com,Profit,false,1994,Under 10,MU - Manufacturers,SU - Suppliers,,339920 - Sporting and Athletic Goods Manufacturing,423910 - Sporting and Recreational Goods and Supplies Merchant Wholesalers ,
Perry s Catering,Caterers   ,MBE,SLBE,,true,true,499B Washington Street Dorchester MA 02124,Dorchester,MA,02124,Mr. Kenneth R Perry,Owner,(617) 413-8732,(800) 799-2110,prryperrys@aol.com,Profit,false,,Under 10,CT - Catering,,,722320 - Caterers,,
"Peterson Party Center, Inc.","Rental of event equipment, including tents, linens, tables, chairs, grills, etc. ",,SBE,,false,true,36 Cabot Road Woburn MA 01801,Woburn,MA,01801,Ms. Karen M Saporito,,(781) 729-4000,(781) 729-4999,,Profit,false,1954,41-100,EP - Equiment Rental (Heavy Construction),"FD - Food Products, Services",,532310 - General Rental Centers,532420 - Office Machinery and Equipment Rental and Leasing,812331 - Linen Supply 
"Pilot Consulting Services, Inc.","Professional and technical management consulting, research and analytical services to public and private clients, particularly in the fields of health and human services.  This is a Service Disabled Veteran Owned Small Business Enterprise (SDVOSBE).   ",,SBE,SDVOSB,false,false,34 Bennett Street North Gloucester MA 02135,North Gloucester,MA,02135,"Mr. Thomas Mannle, Jr.",President,(978) 491-9774,,tmannle@comcast.net,Profit,false,2001,,COS - Consultants: Systems Analysis,COM - Consultants: Management,,541611 - Administrative Management and General Management Consulting Services ,,
Pinctada Events LLC,Event management and consulting; vendor selection and negotiation; set design; lighting; sound; etc.   ,MBE,SBE,,false,false,43 Governor Winthrop Road Somerville MA 02145,Somerville,MA,02145,Mr. Daniel Skeritt,,(617) 800-5562,(617) 996-9068,pinctadaevents@gmail.com,Profit,false,2012,10-20,AD - Advertising/Audovisual Graphic Design/Marketing Public Relations,,,561920 - Convention and Trade Show Organizers,,
Pinnick Construction and Associates,Demolition; masonry; painting; general building construction; carpentry; historic restoration; landscaping   ,MBE,SBE,,false,true,23 McDonnell Drive Randolph MA 02368,Randolph,MA,02368,Mr. Zachary Pinnick,Owner,(781) 885-3264,(781) 885-3294,pinnickconstruction@comcast.net,Profit,true,2009,,"SI - Sitework (Excavation, Demolition, Utilities, Sewage, see also GC)",CM - Concrete & Masonry Contractors,CA - Carpentry,238910 - Site Preparation Contractors,238140 - Masonry Contractors ,238320 - Painting and Wall Covering Contractors
Planning & Development Applications,Construction management; infrastructure management; cost estimating; scheduling; utilities management   ,WBE,,,true,true,96 Evergreen Way Belmont MA 02478,Belmont,MA,02478,Shoreh T Karaa,President,(617) 484-0006,(617) 484-0026,,Profit,false,1988,Under 10,CE - Construction Estimating,CON - Consultants: Environmental,TA - Training (see also ED),,,
"PMA Consultants, LLC",Construction management consulting firm which provides project management; project and cost control; and claims and dispute resolution services to various sectors including; educational and commercial facilities; life sciences; hospitality; industrial; tr   ,MBE,,,true,true,25 Braintree Hill Office Park Braintree MA 02184,Braintree,MA,02184,"Dr. Gui J Ponce de Leon,P.E.",Principal,(781) 794-1404,(781) 794-1405,info@pmaconsultants.com,Profit,false,1971,Over 100,COM - Consultants: Management,,CE - Construction Estimating,,,
Premium Insulation Services,"HVAC, plumbing, mechanical, insulation contractor",MBE,SLBE,,true,true,58 Sanford Street Boston MA 02126,Boston,MA,02126,Mr. Asive Osborne,Owner,(617) 792-6978,,asiveosborne@gmail.com,Profit,true,2007,Under 10,"ME - Mechanical Contractors (HVAC, Plumbing, Insulation, Service, see also GC, PB)",PB - Plumbing,,"238220 - Plumbing, Heating, and Air-Conditioning Contractors ",238310 - Drywall and Insulation Contractors ,
Pressed for Time Printing dba ProPrint,Printing and copying services   ,,SLBE,,false,false,410 Boylston Street Boston MA 02116,Boston,MA,02116,Mr. Joseph H Arthur,owner,,,,Profit,false,1994,21-40,PT - Printers,,,,,
Pressed for time printing Inc d/b/a,Printing and Copying Services   ,,,,false,false,410 Boylston Street Boston MA 02116,Boston,MA,02116,Joseph H Arthur,Mr.,(617) 267 4113,(617) 421 9350,,Not-for-Profit,false,1994,21-40,PT - Printers,AD - Advertising/Audovisual Graphic Design/Marketing Public Relations,,,,
"Prestige Construction, LLC",Kitchen remodel; bathroom; roof; siding; decks; windows; doors; foundations   ,MBE,SLBE,,false,false,1295 River Street Hyde Park MA 02136,Hyde Park,MA,02136,Mr. Josue Soto,CEO,(617) 652-6853,,jsoto@prestigeconstructionllc.com,Profit,true,2018,Under 10,GC - General Contractors,CA - Carpentry,CM - Concrete & Masonry Contractors,236118 - Residential Remodelers ,,
Prince Street Ltd.,Full service catering;   ,WBE,SLBE,,false,false,8 Perkins Street Jamaica Plain MA 02130,Jamaica Plain,MA,02130,Ms. Laura Edelstein,Owner,(617) 983-0440,,laurathecaterer@aol.com,Profit,false,1984,10-20,CT - Catering,"CS - Concession Stands (Food, Newspa[er, Cigarettes, etc.)",,722320 - Caterers,,
"Prive Parking, LLC",Valet parking   ,MBE,SLBE,,false,true,409 Dudley Street Boston MA 02119,Boston,MA,02119,Mr. Ricardo Pierre-Louis,Owner,(508) 326-6929,,ricardo@priveparkingboston.com,Profit,false,2012,21-40,"PK - Parking Lot (Mgmt., Maintenance)",,,812930 - Parking Lots and Garages ,,
"Professional Elevator Services, Inc.","Elevator installation, modernization, maintenance and repairs   ",MBE,SBE,,true,false,1808 South State Street Chicago IL 60616,Chicago,IL,60616,Mr. Kenneth W Mason,President,(312) 842-6715,(312) 842-4450,gloria@proelevator.com,Profit,true,1990,21-40,EV - Elevator Contractors,,,238290 - Other Building Equipment Contractors ,,
"Project for Community Adolescence and Family, Inc.","Serve the underserved through health promotions, educational support and trainings to decrease disparities   ",MWBE,,,true,false,369 Broadway Everett MA 02149,Everett,MA,02149,Ms. Monique Louis,CEO/President,(617) 387-4020,(617) 387-4021,projectforcommunity@verizon.net,Not-for-Profit,false,,Under 10,MO - Multi Service Organizations,ES - Elderly Services,"ED - Education (see also OS, TA)",611710 - Educational Support Services,624190 - Other Individual and Family Services ,
"PRWT Services, Inc.",Business process outsourcing and facilities management   tration,MBE,,,true,false,1835 Market Street Philadelphia PA 19103,Philadelphia,PA,19103,Mr. Willie Johnson,,(215) 569-8810,(215) 569-9893,nequel.armstead@prwt.com,Profit,false,1988,Over 100,"CP - Computer (Hardware, Software, Design, Data Processing (see also COS, COT)",COM - Consultants: Management,"OS - Office Services (Clerical Support, Employment, Court Reporting, Typing, etc., see also EM)",541611 - Administrative Management and General Management Consulting Services ,,
Pure Colors,"Painting,contractor, residential and commercial, interior and exterior; carpentry, tile and masonry.   ",WBE,SBE,,true,true,374 River Road Hudson MA 01749,Hudson,MA,01749,Ms. Mirela DoValle,Owner,(978) 562-7873,,mirela@purcolorsllc.com,Profit,true,2015,Under 10,PA - Painting and Papering Contractors,CA - Carpentry,CM - Concrete & Masonry Contractors,238320 - Painting and Wall Covering Contractors,238340 - Tile and Terrazzo Contractors,238140 - Masonry Contractors 
"Q.E.D., Inc. dba QED National",IT staffing and reselling services   ,WBE,,,true,false,350 7th Avenue New York NY 10001,New York,NY,10001,Ms. Colleen Molter,President,(212) 481-6868,(212) 481-0414,cmolter@quenational.com,Profit,false,1993,41-100,"CP - Computer (Hardware, Software, Design, Data Processing (see also COS, COT)","EM - Employement (see also OS, TR)",,561320 - Temporary Help Services,541512 - Computer Systems Design Services ,541513 - Computer Facilities Management Services 
"Qlarion, Inc.",Business intelligence consulting services   ,,SBE,,false,true,12007 Sunrise Valley Drive Reston VA 20191,Reston,VA,20191,Mr. Jake Bittner,CEO,(703) 248-9942,(703) 260-6362,jbittner@qlarion.com,Profit,false,2001,21-40,COM - Consultants: Management,"CP - Computer (Hardware, Software, Design, Data Processing (see also COS, COT)",COS - Consultants: Systems Analysis,541511 - Custom Computer Programming Services ,541512 - Computer Systems Design Services ,541519 - Other Computer Related Services
"QuickPay, Inc.",Automated payroll services   ,MBE,SBE,,false,false,1073 Hancock Street Quincy MA 02169,Quincy,MA,02169,Mr. Ndamati Timothy,President,(617) 471-3343,(617) 847-4297,timothy@st-quickpay.com,Profit,false,1999,Under 10,"OS - Office Services (Clerical Support, Employment, Court Reporting, Typing, etc., see also EM)",,,561499 - All Other Business Support Services ,,
RAAD Electric,"Electrical contractor:  residential, commercial and industrial projects   ",MBE,SBE,,false,true,44 Ledgebrook Avenue Stoughton MA 02072,Stoughton,MA,02072,Mr. Nedal Altanbour,Owner,(508) 958-1331,(781) 436-3430,raadcoo@yahoo.com,Profit,true,2002,Under 10,EL - Electrical Contractors,,,238210 - Electrical Contractors and Other Wiring Installation Contractors,,
Rafanelli Events,"Events planner:  event design, management and production services   ",,SLBE,,false,false,867 Boylston Street Boston MA 02116,Boston,MA,02116,Mr. Bryan Rafanelli,,(617) 357-1818,,,Profit,false,,,AD - Advertising/Audovisual Graphic Design/Marketing Public Relations,,,561920 - Convention and Trade Show Organizers,"711320 - Promoters of Performing Arts, Sports, and Similar Events without Facilities ",
"Raj Technologies, Inc.","Business and IT consulting; application development,; systems integration; data and network management; document imaging services; web-based solutions   ",MBE,,,false,false,110 Terminal Drive Plainview NY 11803,Plainview,NY,11803,Mr. Raj Mehta,President,(516) 828-9494,(516) 576-9499,rajm@rajechny.com,Profit,false,1990,41-100,COS - Consultants: Systems Analysis,COP - Consultants: Public Relations,,,,
