company_name,services_provided,mbe_wbe_cert,small_local_cert,veteran_cert,sdo_cert,has_bais_id,address,city,state,zipcode,contact_name,contact_title,phone,fax,email,business_type,construction,year_established,number_employees,business_area_1,business_area_2,business_area_3,naics_1,naics_2,naics_3
"212/Harakawa, Inc.","Graphic design services; designing ""way finding"" signage   ",MWBE,,,false,false,236 W 27th Street New York NY 10001,New York,NY,10001,Ms. Ann Harakawa,Principal,(212) 254-6670,(212) 254-6614,spariag@twotwelve.com,Profit,false,1990,21-40,AD - Advertising/Audovisual Graphic Design/Marketing Public Relations,,,541430 - Graphic Design Services,,
"3 South, LLC","First responder equipment, services, solutions   ",WBE,SBE,,false,true,3175 Conway Drive Baton Rouge LA 70809,Baton Rouge,LA,70809,Ms. Charlotte Johnston,Owner,(504) 858-1955,(504) 324-0969,charlotte@3southcompanies.com,Profit,false,2011,Under 10,SA - Safety Products,TA - Training (see also ED),SU - Suppliers,423840 - Industrial Supplies Merchant Wholesalers,423990 - Other Miscellaneous Durable Goods Merchant Wholesalers ,"541990 - All Other Professional, Scientific, and Technical Services"
"617 Home Improvement, Inc.",Home Improvement Company   ,WBE,SBE,,false,false,20 Boston Street Malden MA 02148,Malden,MA,02148,Ms. Kristina Filozova,President,(617) 659-1449,,617homeimprovement@gmail.com,Profit,true,2017,Under 10,CA - Carpentry,"FL - Floor Contractors (Carpet, Tile, Linoleum)",,236118 - Residential Remodelers ,236220 - Commercial and Institutional Building Construction ,236210 - Industrial Building Construction 
"813 Consultants, LLC","Low overhead staffing, payroll, and consulting services   ",WBE,SLBE,,true,false,10 Coniston Road Roslindale MA 02131,Roslindale,MA,02131,Ms. Kristen Harrington,President,(617) 435-9123,,813consultants@gmail.com,Profit,false,2015,Under 10,"OS - Office Services (Clerical Support, Employment, Court Reporting, Typing, etc., see also EM)","EM - Employement (see also OS, TR)",,561320 - Temporary Help Services,541214 - Payroll Services ,561110 - Office Administrative Services
84 Lumber Company,Building materials and supplies; home center   ,WBE,,,true,false,1019 Route 519 Eighty Four PA 15330,Eighty Four,PA,15330,Ms. Margaret Magerko,President/CEO,(724) 223-8400,(866) 358-2961,deja.glemba@84lumber.biz,Profit,true,1956,Over 100,SU - Suppliers,,,444110 - Home Centers ,444190 - Other Building Material Dealers ,
"A & A Metro Transportation/Bills Taxi Service, Inc.",Transportation services   ,,SBE,,false,true,1001 Bedford Street Bridgewater MA 02346,Bridgewater,MA,02346,Mr. Thomas Arrighi,,(508) 697-0017,(508) 697-0043,tarrighi@aametro.com,Profit,false,,41-100,"TR - Travel, Transportation (Travel Agencies, Planning, Limo Services)",,,485310 - Taxi Service ,,
"A B C Maintenance of Boston, Inc.",Janitorial services; commercial and residential   ,MBE,SLBE,,true,false,328 Gallivan Boulevard Dorchester MA 02124,Dorchester,MA,02124,Mr. John Thi,Owner,(617) 298-3093,(617) 698-0901,,Profit,false,1983,21-40,"JA - Janitorial Services/Supplies (see also MA, RS)","MA - Maintenance (Industrial, Commericial, Residential, see also JA, RS)",,,,
ABC Specialtees,Custom apparel embroidery and screenprinting; promotional items; awards; gifts; banners   ,WBE,SBE,,false,true,525 Washington Street Whitman MA 02382,Whitman,MA,02382,Ms. Barbara Sheldon,Owner,(781) 447-1532,,deb@abcspecialtees.com,Profit,false,1995,Under 10,AL - Apparel,PT - Printers,RT - Retail Sales of Art & Framing,541430 - Graphic Design Services,314999 - All Other Miscellaneous Textile Product Mills ,453998 - All Other Miscellaneous Store Retailers (except Tobacco Stores) 
Abel Floor Covering,"Carpet, ceramic tile, V.C.T. linoleum, etc.   ",MBE,,,false,true,410 Neponset Avenue Dorchester MA 02122,Dorchester,MA,02122,Mr. Abel Matos,Owner,(617) 288-0103,(617) 288-8012,abelfloor@verizon.net,Profit,true,1989,Under 10,"FL - Floor Contractors (Carpet, Tile, Linoleum)",RT - Retail Sales of Art & Framing,,238330 - Flooring Contractors,,
"A Better Resolution, Inc.",Audio/visual production; multimedia production   ,MBE,SLBE,,false,false,1313 Washington Street Boston MA 02118,Boston,MA,02118,Mr. Francis Miranda,President,(617) 338-2022,(617) 507-5863,frank@abetterresolution.com,Profit,false,1997,Under 10,AD - Advertising/Audovisual Graphic Design/Marketing Public Relations,ET - Entertainment/Entertainer,,532490 - Other Commercial and Industrial Machinery and Equipment Rental and Leasing ,512110 - Motion Picture and Video Production ,
"Above and Beyond Catering, Inc.",Catering and event planning   ,MBE,SLBE,,false,true,42 Plympton Street Boston MA 02118,Boston,MA,02118,Mr. Mark A Haley,Owner,(617) 426-5999,(617) 422-0758,mark@aboveabc.com,Profit,false,1997,41-100,CT - Catering,,,722320 - Caterers,561499 - All Other Business Support Services ,
"Accent Banner, LLC","Fabricator of banners, flags and soft signage   ",WBE,SBE,,false,true,12 Locust Street Medford MA 02155,Medford,MA,02155,Ms. Alice Dietrich,,(781) 391-7300,,,Profit,false,,10-20,AD - Advertising/Audovisual Graphic Design/Marketing Public Relations,"FB - Fabricators (Metals, Plastics)",,453998 - All Other Miscellaneous Store Retailers (except Tobacco Stores) ,314999 - All Other Miscellaneous Textile Product Mills ,238990 - All Other Specialty Trade Contractors
A.C.P. Facility Services,"Commercial contract cleaning, windows, floors and carpet   ",MBE,,,true,false,12 Gill Street Woburn MA 01801,Woburn,MA,01801,Mr. Michael White,COO,(781) 932-0500,(781) 932-0589,info@acpcleaning.com,Profit,false,1986,Over 100,"JA - Janitorial Services/Supplies (see also MA, RS)","MA - Maintenance (Industrial, Commericial, Residential, see also JA, RS)",,,,
"A.C.S. Mechanical, LLC",Sheetmetal contractor   ,MBE,SLBE,,false,false,300 Washington Street Dorchester MA 02121,Dorchester,MA,02121,Mr. Gary Lynch,Owner,(781) 308-1151,(617) 963-7142,acsmechanical@hotmail.com,Profit,true,2012,Under 10,"ME - Mechanical Contractors (HVAC, Plumbing, Insulation, Service, see also GC, PB)",,,"238220 - Plumbing, Heating, and Air-Conditioning Contractors ",238990 - All Other Specialty Trade Contractors,
Advanced Architectural Metal Specialties,"Fabrication and installation of stairs, rails and miscellaneousmetals for commercial construction projects; also specialize in structural pile fabrication   ",WBE,SBE,,true,false,P.O. Box 930 North Dighton MA 01764,North Dighton,MA,01764,Ms. Diane W Johanson,President,(508) 824-8333,(508) 824-5562,dianejohanson@aol.com,Profit,false,1997,Under 10,"FB - Fabricators (Metals, Plastics)",WE - Welding (see also FB),"ST - Steel Contractos (Reinforcing, Erecting, see also FB, GC)",332323 - Ornamental and Architectural Metal Work Manufacturing ,,
Advanced Pest Control Services,Pest control services   ,MBE,SBE,,true,false,PO Box 172 North Quincy MA 02171,North Quincy,MA,02171,Ms. Martin Meyers,Owner,(617) 859-7077,,apcs34@yahoo.com,Profit,false,1988,Under 10,PE - Pest Control,,,561710 - Exterminating and Pest Control Services,,
Advertising Business Concepts,"Advertising specialties; printing of forms, envelopes, and letterhead; print (screen) sportswear   ",MBE,SLBE,,false,true,8 Dennison Street Roxbury MA 02119,Roxbury,MA,02119,Mr. Carlton D Smith,Owner,(617) 445-6171,(617) 445-4601,abconcepts1@verizon.net,Profit,false,1990,Under 10,PT - Printers,AD - Advertising/Audovisual Graphic Design/Marketing Public Relations,AL - Apparel,,,
"Advoqt, LLC",Technology consulting; sales of tech services; systems integration   ,MBE,SLBE,,true,true,10 Guest Street Boston MA 02135,Boston,MA,02135,Mr. Reinier Moquete,Owner,(617) 835-4525,,rm@advocatetg.com,Profit,false,2012,10-20,"CP - Computer (Hardware, Software, Design, Data Processing (see also COS, COT)",COS - Consultants: Systems Analysis,,541511 - Custom Computer Programming Services ,541512 - Computer Systems Design Services ,541519 - Other Computer Related Services
Affordable Building Solutions LLC,"Asbestos abatement; selective demolition; microbial remediation; water/fire damage restoration; janitorial services, residential and commercial   ",MWBE,SBE,,true,false,60 Easton Street Lawrence MA 01843,Lawrence,MA,01843,Ms. Delsy Orellana,Owner,(617) 633-1269,,abuildingsolutions@gmail.com,Profit,true,2013,Over 100,AB - Aspestos Control,"JA - Janitorial Services/Supplies (see also MA, RS)",,562910 - Remediation Services ,561720 - Janitorial Services ,238990 - All Other Specialty Trade Contractors
"Affordable Construction, Inc.","Provide complete construction, including tiles, marble, painting, etc.   ",MBE,SLBE,,false,true,10 Mercier Avenue Dorchester MA 02124,Dorchester,MA,02124,Mr. Richard Prosper,,(617) 799-4868,(617) 929-4436,rprosper26@comcast.net,Profit,true,1991,Under 10,PA - Painting and Papering Contractors,CM - Concrete & Masonry Contractors,GC - General Contractors,238320 - Painting and Wall Covering Contractors,238340 - Tile and Terrazzo Contractors,238390 - Other Building Finishing Contractors
"Air Water Energy Engineers, Inc.","Mechanical, electrical, plumbing and fire protection engineering; energy modeling; and geothermal engineering   ",MBE,SBE,,true,false,78 Blanchard Road Burlington MA 01803,Burlington,MA,01803,Mr. George Hu,President,(781) 652-8688,(781) 652-8689,george.hu@awe-e.com,Profit,true,2007,Under 10,"ME - Mechanical Contractors (HVAC, Plumbing, Insulation, Service, see also GC, PB)",AE - Architects/Engineers,,"238220 - Plumbing, Heating, and Air-Conditioning Contractors ",541330 - Engineering Services,
A.J. Williams Event,Full event planning/management; public relations; graphic design and fundraising   ,MWBE,SLBE,,false,false,75 Newbury Street Boston MA 02116,Boston,MA,02116,Ms. AJ Williams,President,(617) 267-2244,(617) 267-2203,aj@ajwilliamsevents.com,Profit,false,2002,Under 10,AD - Advertising/Audovisual Graphic Design/Marketing Public Relations,MO - Multi Service Organizations,,541613 - Marketing Consulting Services ,541820 - Public Relations Agencies,541870 - Advertising Material Distribution Services
"Alcantara, Jasmine (dba JLA Group)",Project management; strategic planning and communications; acquisitions/procurement support; change/performance management   ,MWBE,SBE,,true,false,61 Starbuck Road Nantucket MA 02554,Nantucket,MA,02554,Ms. Jasmine Alcantara,Owner,(774) 236-0765,,jla@jlausa.com,Profit,false,2015,Under 10,BU - Business Management Consultants,COM - Consultants: Management,"RE - Real Estate (Development, Management, Sales and Appraisals)",541611 - Administrative Management and General Management Consulting Services ,561110 - Office Administrative Services,531210 - Offices of Real Estate Agents and Brokers
"Alliance Detective & Security Service, Inc",Armed and unarmed security guards; patrol services; alarm response; alarm and CCTV monitoring; investigations   ,WBE,SBE,,true,true,930 Broadway Everett MA 02149,Everett,MA,02149,Ms. Marianne Jenkins,President,(617) 387-1261,(617) 389-0022,khartung@alliancesecurityservice.com,Profit,false,1975,Over 100,"SE - Security (Guards, Dogs, Systems)",,,561611 - Investigation Services ,561612 - Security Guards and Patrol Services ,
Alliance Glass Corporation,Glass and glass products   ,,SLBE,,false,true,902 Dorchester Avenue Boston MA 02125,Boston,MA,02125,Mr. Stephen Libman,President,(617) 265-4500,(617) 265-4503,steve@allianceglass.com,Profit,false,,Under 10,GG - Glass/Glazing Contractors,,,238150 - Glass and Glazing Contractors ,811122 - Automotive Glass Replacement Shops ,
"Allston Towing Services and Repairs, Inc.",Towing services   ,MBE,SLBE,,false,false,100 Hano Street Allston MA 02135,Allston,MA,02135,Mr. Javier Rivas,President,(617) 771-8690,(617) 787-1181,javiertacoma@gmail.com,Profit,false,2004,,TK - Trucking (Waste Disposal Commodities Transport),,,488410 - Motor Vehicle Towing,,
"All Time Service, Inc.","Janitorial services, including post construction cleaning and interior and exterior window washing   ",MWBE,SLBE,,false,true,89 Forest Hills Street Jamaica Plain MA 02130,Jamaica Plain,MA,02130,Ms. Janet Peguero,President,(617) 524-0635,(617) 522-4014,jpeguero@alltimeservice.com,Profit,false,1996,41-100,"JA - Janitorial Services/Supplies (see also MA, RS)",,,561720 - Janitorial Services ,,
"Alpha Three Consulting, LLC","Management and technical services consulting firm, providing services on a project, staff augmentation, or consulting basis   ",WBE,,,false,false,3000 Atrium Way Mount Laurel NJ 08054,Mount Laurel,NJ,08054,Ms. Stephanie Sanders,Senior Partner,(267) 971-3905,,stephanie.sanders@alphathree.com,Profit,false,2007,Over 100,COM - Consultants: Management,CN - Construction Management: Small Commercial Projects,COD - Consultants: Design,541611 - Administrative Management and General Management Consulting Services ,541618 - Other Management Consulting Services ,541690 - Other Scientific and Technical Consulting Services
Always Book A Wallys Band,Theatrical booking agent   ,MBE,SLBE,,false,false,27 Rutland Square Boston MA 02118,Boston,MA,02118,"Mr. Frank Poindexter, Jr.",Owner,(617) 828-1754,,ffpjr1@gmail.com,Profit,false,,,AD - Advertising/Audovisual Graphic Design/Marketing Public Relations,,,"711410 - Agents and Managers for Artists, Athletes, Entertainers, and Other Public Figures",,
Amador Bilingual Voiceovers/Sol & Canto,Latin music agency   ,MWBE,SBE,,false,true,199 Pemberton Street Cambridge MA 02140,Cambridge,MA,02140,Ms. Rosemarie Straijer-Amador,Director,(617) 492-1515,(617) 649-0299,rosi@musicamador.com,Profit,false,,Under 10,ET - Entertainment/Entertainer,AD - Advertising/Audovisual Graphic Design/Marketing Public Relations,,"711320 - Promoters of Performing Arts, Sports, and Similar Events without Facilities ",,
"American Contractors Design and Finish, Inc.","Construction company specializing in carpentry, painting, drywall",,SBE,,false,false,31 Colonial Drive Dedham MA 02026,Dedham,MA,02026,Mr. Miguel Oliveira,President,(781) 471-5298,,mdiaz@amci.us,Profit,true,2010,10-20,CA - Carpentry,"PL - Plastering, Drywall Contractors",CN - Construction Management: Small Commercial Projects,236210 - Industrial Building Construction ,236220 - Commercial and Institutional Building Construction ,
"American Diagnostic Lab, Inc. dba",Health care equipment and supplies   ,MBE,SBE,,true,true,A+ Home Medical Supply Company New Bedford MA 02740,New Bedford,MA,02740,Mr. Gope Gidwani,President,(508) 984-5200,(508) 819-6998,ahomemedical@gmail.com,Profit,false,1994,Under 10,SU - Suppliers,,,,"423450 - Medical, Dental, and Hospital Equipment and Supplies Merchant Wholesalers ",
"American Green Building Construction Services, Inc.","General contracting, painting, flooring   ",MBE,SBE,,true,false,190 Milton Street Dedham MA 02026,Dedham,MA,02026,Mr. Ariel Peguero,President,(781) 461-2500,(781) 461-1234,apeguero@agbserv.com,Profit,true,2013,Under 10,GC - General Contractors,PA - Painting and Papering Contractors,"FL - Floor Contractors (Carpet, Tile, Linoleum)",236220 - Commercial and Institutional Building Construction ,238330 - Flooring Contractors,238320 - Painting and Wall Covering Contractors
"American Green Building Services, Inc.",Commercial janitorial and maintenance services   ,MBE,,,true,true,190 Milton Street Dedham MA 02026,Dedham,MA,02026,Mr. Ariel Peguero,Owner,(781) 461-2500,(781) 461-1234,,Profit,false,2010,41-100,"JA - Janitorial Services/Supplies (see also MA, RS)","SI - Sitework (Excavation, Demolition, Utilities, Sewage, see also GC)",,561720 - Janitorial Services ,238910 - Site Preparation Contractors,
"American Translation Partners, Inc.","Language services:  An international network of language professionals; assist a myriad of industries and markets, including but not limited to government, legal, medical, insurance, technical, financial, internet, software; assist with more than 150 languages",MWBE,SBE,,true,true,"1 Trowbridge Road, Suite 340 Buzzards Bay MA 02536",Buzzards Bay,MA,02536,Ms. Polly Crystal,CEO,(508) 823-8892,(508) 823-8854,scott@atptranslations.com,Profit,false,2000,Under 10,COV - Consultants: Translation,,,541930 - Translation and Interpretation Services,,
"Amerphil, Inc.",Excavation; underground utilities; sitework; general building   ,MBE,,,true,true,P.O. Box 761089 Melrose MA 02176,Melrose,MA,02176,Mr. Roberto R Mercado,President,(781) 322-6100,(781) 321-6862,amerphil@aol.com,Profit,true,1993,Under 10,"SI - Sitework (Excavation, Demolition, Utilities, Sewage, see also GC)",GC - General Contractors,,238910 - Site Preparation Contractors,"484110 - General Freight Trucking, Local ",
A & M Home Services LLC,Landscape; hardscape; excavation; bobcat services; junk removal; maintenance; distribution center; snow removal   ,MBE,SLBE,,false,true,34 Vale Street Roxbury MA 02119,Roxbury,MA,02119,Mr. Adam Nurse,Co-Owner,(617) 697-2353,,aandmhomeservices@yahoo.com,Profit,false,2014,Under 10,LA - Landscaping Contractors,"SI - Sitework (Excavation, Demolition, Utilities, Sewage, see also GC)","RE - Real Estate (Development, Management, Sales and Appraisals)",561730 - Landscaping Services,238990 - All Other Specialty Trade Contractors,
AMRO Environmental Lab. Corp.,Chemical testing; analytical testing   ,WBE,,,true,false,111 Herrick Street Merrimack NH 03054,Merrimack,NH,03054,Ms. Maria Borduz,President,(603) 424-2022,(603) 429-8496,info@amrolabs.com,Profit,false,1987,41-100,"EN - Environmental Consultants ( Planning, Soil Boring, Hazardous Waste Treatment, etc.)",,,,,
"Angelini Plastering, Inc.",Light guage metal framing; insulation; gypsum board; all phases of plastering; acoustical plaster; EIFS; BASWAphon; drywall; GFRG   ,WBE,SBE,,false,false,304 Main Street North Reading MA 01864,North Reading,MA,01864,Ms. Jodi Angelini,President,(978) 664-3836,(978) 664-0771,jangelini@angeliniplastering.com,Profit,true,1981,21-40,"PL - Plastering, Drywall Contractors",,,238310 - Drywall and Insulation Contractors ,,
Angelo's Cleaning Company,Commercial and residential cleaning company,MWBE,SLBE,,false,false,110 Antwerp Street Brighton MA 02135,Brighton,MA,02135,Ms. Janee Jones,Owner,(857) 615-6388,,angeloscleaningcom@gmail.com,Profit,false,2019,Under 10,"JA - Janitorial Services/Supplies (see also MA, RS)","MA - Maintenance (Industrial, Commericial, Residential, see also JA, RS)",,561720 - Janitorial Services ,,
Annette Dillard Inc.,"General contractor, residential and commercial Commercial  ",WBE,SBE,,false,false,21 Ellsworth Street Brockton MA 02301,Brockton,MA,02301,Ms. Annette Dillard,,(508) 897-0400,(508) 586-4986,,Profit,true,2002,Under 10,GC - General Contractors,CA - Carpentry,PA - Painting and Papering Contractors,,,
"Anvil Steel Engineering, Inc.","All facets of iron work including but not limited to:  structural bridges, precast, reinforcing and welding.  This is a Veteran Owned Small Business Enterprise (VOSBE).   ",MBE,SBE,VOSB,false,false,256 Prospect Hill Street Taunton MA 02780,Taunton,MA,02780,Mr. Lamont Davis,President,(617) 799-1614,(508) 880-0301,anvilsteelinc@gmail.com,Profit,true,2014,Under 10,"ST - Steel Contractos (Reinforcing, Erecting, see also FB, GC)",,,237990 - Other Heavy and Civil Engineering Construction ,,
Anytime Auto Glass LLC,Auto glass replair and replacement   ,,SLBE,,false,true,1560 River Street Hyde Park MA 02136,Hyde Park,MA,02136,Ms. Kellyann Coyne,Owner,(617) 898-8463,(617) 361-2859,anytimeautoglassboston@gmail.com,Profit,true,2013,Under 10,GG - Glass/Glazing Contractors,"AU - Automobile (Sales, Services, Leasing, Rental)",,811122 - Automotive Glass Replacement Shops ,,
A.O. Security Services,Watch guard and patrol agency   ,MBE,SLBE,,false,false,2 Drayton Avenue Dorchester MA 02125-2403,Dorchester,MA,02125-2403,Mr. Andres Otero,President,(617) 970-6772,(617) 265-1249,aossinc1@gmail.com,Profit,false,,10-20,"SE - Security (Guards, Dogs, Systems)",,,561612 - Security Guards and Patrol Services ,,
"A-Plus Welding and Engineering, Inc.",Structural steel erection; misc. metals; rebar and mesh and post tensioning; welding; ornamental steel; stairs and railings; marine construction   ,MBE,SLBE,,false,false,366 Walnut Avenue Roxbury MA 02119,Roxbury,MA,02119,Mr. Edward Jordan,Owner,(857) 389-6243,,weldboston54@gmail.com,Profit,true,2007,Under 10,"ST - Steel Contractos (Reinforcing, Erecting, see also FB, GC)",WE - Welding (see also FB),,238120 - Structural Steel and Precast Concrete Contractors ,238990 - All Other Specialty Trade Contractors,
"Appraisers Collaborative, Inc., The",All types of real estate appraisal   ,WBE,SBE,,true,true,150 Wood Road Braintree MA 02184,Braintree,MA,02184,Ms. Mary E Granville,President,(781) 356-2300,(781) 356-2345,mary@appraiserscollaborative.com,Profit,false,1980,10-20,RS - Residential Services,"RE - Real Estate (Development, Management, Sales and Appraisals)",COR - Consultants: Relocation,531320 - Offices of Real Estate Appraisers ,,
Appropriate Environmental Technologies,Environmental consulting and procurement of goods   site audit; underground tank removal,MBE,,,false,true,P.O. Box 230946 Boston MA 02123,Boston,MA,02123,Mr. Oliver C Udemba,President,(508) 215-6941,,approetec@aol.com,Profit,false,1997,Under 10,CON - Consultants: Environmental,"EN - Environmental Consultants ( Planning, Soil Boring, Hazardous Waste Treatment, etc.)",HW - Hazardous Waste Management (see also EN and CON),,,
"A.R. Belli, Inc.","General contractors for road and utilities:  water, sewer and drain pipe installation; excavation, curbing; concrete; paving; and landscaping   concrete; paving; and landscaping",WBE,SBE,,true,true,271 Nevada Street Newtonville MA 02460,Newtonville,MA,02460,Ms. Cynthia Sementelli,President,(617) 332-8855,(617) 332-2158,,Profit,true,1996,21-40,"RO - Road, Railroad, Highway, Bridge Contractors (see also PV)",CM - Concrete & Masonry Contractors,"SI - Sitework (Excavation, Demolition, Utilities, Sewage, see also GC)","237310 - Highway, Street, and Bridge Construction ",237110 - Water and Sewer Line and Related Structures Construction ,
Archdale Construction Company,Excavation; water; sewer; drain; asphalt; landscaping  ,WBE,,,false,false,12 Worchester Drive Norwood MA 02062,Norwood,MA,02062,Ms. Ann M LaRosa,President,(781) 769-1014,(617) 469-2323,,Profit,true,1985,Under 10,"SI - Sitework (Excavation, Demolition, Utilities, Sewage, see also GC)",PV - Paving Contractors,LA - Landscaping Contractors,,,
"Archipelago Strategies Group, Inc.",Marketing; advertisement production; public relations; social media management; branding; website design; event planning; management consulting   ,MWBE,SLBE,,true,true,51 Melcher Street Boston MA 02210,Boston,MA,02210,Ms. Josiane Martinez,CEO and Founder,(617) 419-6989,,josiane@discoverasg.com,Profit,false,2013,Under 10,AD - Advertising/Audovisual Graphic Design/Marketing Public Relations,COM - Consultants: Management,,541613 - Marketing Consulting Services ,541820 - Public Relations Agencies,
"Architects Forum, Inc., The",Architectural planning:  new construction and renovation and renovation  ,MBE,SBE,,true,false,72 Manchester Road Newton MA 02461,Newton,MA,02461,Mr. Chalermpol Intha,President,(617) 244-4669,(617) 964-6090,intha@rcn.com,Profit,false,1983,Under 10,AE - Architects/Engineers,,,541310 - Architectural Services,,
"Architectural Engineers, Inc.","Civil, structural, mechanical, electrical and fire protection   ",WBE,SLBE,,true,true,63 Franklin Street02110- Boston MA 02110,Boston,MA,02110,Ms. Robin S Greenleaf,CEO,(617) 542-0810,(617) 542-8451,jgoodmonson@arcengrs.com,Profit,false,1985,21-40,"COA - Consultants: Architecture, Engineering",,,541330 - Engineering Services,,
ARQ Architects,Architectural services   ,WBE,SBE,,false,false,1 Government Street Kittery ME 03904,Kittery,ME,03904,Ms. Lucinda Schlaffer,Partner,(207) 439-5289,(207) 439-9531,lucy@arqarchitects.com,Profit,false,1985,Under 10,AE - Architects/Engineers,,,541310 - Architectural Services,,
"Arrest A Pest, Inc.",Residential and commercial pest control including structural pests   ,WBE,SBE,,false,false,42 Harding Avenue Braintree MA 02184,Braintree,MA,02184,Ms. Corrine Cavanaugh,,(781) 849-2091,(781) 356-4870,pestcops@yahoo.com,Profit,false,2008,Under 10,PE - Pest Control,,,561710 - Exterminating and Pest Control Services,,
"Arrow Event Management, LLC",Event management services,WBE,SLBE,,false,true,486 Shawmut Avenue Boston MA 02118,Boston,MA,02118,Ms. Emily Olson,Owner,(773) 710-1042,,emily@arrow-events.com,Profit,false,2018,Under 10,AD - Advertising/Audovisual Graphic Design/Marketing Public Relations,COP - Consultants: Public Relations,,561920 - Convention and Trade Show Organizers,541618 - Other Management Consulting Services ,
"Artisan and Son Hardwood Flooring, Inc.","Hardwood floor installation, repair and refinishing   ",MBE,SBE,,false,false,12 Hazelwood Street Malden MA 02148,Malden,MA,02148,Ms. Lan Mai Nguyen,Co-Owner,(617) 293-5303,,lan_m_nguyen12@comcast.net,Profit,true,1991,Under 10,"FL - Floor Contractors (Carpet, Tile, Linoleum)",,,238330 - Flooring Contractors,,
Artistic Explosions,Photography; video production   ,MBE,SLBE,,true,false,90A Hemman Street Roslindale MA 02131,Roslindale,MA,02131,Mr. Donald Rockhead,Owner,(617) 461-5868,,photo@donrockphoto.com,Profit,false,2008,Under 10,PG - Photography,,,"541921 - Photography Studios, Portrait ",541922 - Commercial Photography ,
"ASA Environmental Products, Inc.","Industrial/Construction/Environmental/Marine/Utility products and systems:  Industrial--mil spec chemicals, adhesives, solvents, MRO and green janitorial equipment and supplies; Construction--building materials, equipment, fasteners, tools; Environmental-   ",MWBE,SBE,,true,false,22 Bayview Avenue Stonington CT 06378,Stonington,CT,06378,Ms. Ana M Schneider,President,(860) 535-3931,(860) 535-3970,amschneider@snet.net,Profit,false,1993,Under 10,SU - Suppliers,RT - Retail Sales of Art & Framing,,423710 - Hardware Merchant Wholesalers ,424690 - Other Chemical and Allied Products Merchant Wholesalers ,
